comment_id,body,created_utc,author,subreddit,link_id,parent_id,score,permalink
mqulu7z,"Article:  >__The House of Representatives has voted to enshrine the principle of non-violent parenting in Swiss law.__  >Lawmakers voted 134 to 56 with 2 abstentions, in favour of the amendment to the law, which will now go to the Senate.  >A Swiss People’s Party minority did not support the bill, whose spokesperson described the measure as unnecessary.  >But a majority agreed with the government’s proposal, which said the principle of non-violent parenting would serve as a model. It would clearly signal that corporal punishment and other forms of degrading treatment of children would not be tolerated.  >The bill is based on a motion by parliamentarian Christine Bulliard-Marbach, which was supported by both chambers of parliament in 2021 and 2022.",1746517988.0,BezugssystemCH1903,worldnews,t3_1kfyxpn,t3_1kfyxpn,1,/r/worldnews/comments/1kfyxpn/switzerland_moves_to_ban_smacking_of_children/mqulu7z/
mqul9rl,"Give them hell boys!  Can't imagine the kremlin right now. The stress that their military cossplay is going to be disturbed, trumpy dumpy that seems to turn around now we are rid of musky pusty, trump tariffs and OPEC dropping oil prices.  Haha how are the sycophants going to explain all this to dear dictator? I hope he gets a heart attack.",1746517621.0,ImposterJavaDev,worldnews,t3_1kfyosn,t3_1kfyosn,1,/r/worldnews/comments/1kfyosn/ukrainian_drones_attack_moscow_halting_flights/mqul9rl/
mqulv3x,"'Major millitary parade'... it isn't just this tho is it. It's the victory day parade for ww2 , it's not a great look when you are disrupting a parade to commemorate the defeat of nazi Germany..",1746518004.0,scouserman3521,worldnews,t3_1kfyosn,t3_1kfyosn,1,/r/worldnews/comments/1kfyosn/ukrainian_drones_attack_moscow_halting_flights/mqulv3x/
mqujdzf,"Users often report submissions from this site for sensationalized articles. Readers have a responsibility to be skeptical, check sources, and comment on any flaws.  You can help improve this thread by linking to media that verifies or questions this article's claims. Your link could help readers better understand this issue.  *I am a bot, and this action was performed automatically. Please [contact the moderators of this subreddit](/message/compose/?to=/r/worldnews) if you have any questions or concerns.*",1746516399.0,AutoModerator,worldnews,t3_1kfyljz,t3_1kfyljz,1,/r/worldnews/comments/1kfyljz/starmer_prepares_britain_for_attack_by_russia/mqujdzf/
mqujffe,"***The Telegraph reports:***  Britain is secretly preparing for a direct military attack by Russia amid fears that it [is not ready for war](https://www.telegraph.co.uk/news/2025/03/01/britain-ukraine-russia-war-zelensky-putin-trump-starmer/).  Officials have been asked to update 20-year-old contingency plans that would put the country on a war footing after [threats of attack](https://www.telegraph.co.uk/world-news/2022/09/21/putin-ally-threatens-london-nuclear-strike-alarming-interview/) by the Kremlin.  A classified dossier will set out how the Government would respond to a declaration of war, including bunkers to protect the Cabinet and the Royal family, public service broadcasts and the stockpiling of resources.  Ministers fear that Britain would not only be outgunned by Russia and its allies on the battlefield but would also be [unprepared and poorly defended](https://www.telegraph.co.uk/business/2025/03/12/young-men-unprepared-to-fight-for-britain-says-lord-hammond/) at home.  Kremlin officials have repeatedly threatened the UK with a direct attack over its support for Ukraine, which may soon include [British troops on the ground](https://www.telegraph.co.uk/world-news/2025/04/10/british-troops-could-be-deployed-in-ukraine-for-five-years/).  Experts have warned that the country is vulnerable to an assault on its critical [national infrastructure](https://www.telegraph.co.uk/news/2024/12/03/russia-exploiting-uk-dependence-technology-gchq-destruction/), including gas terminals, undersea cables, nuclear power plants and transport hubs.  The Telegraph understands that an update to the classified “homeland defence plan” will set out a strategy for the days immediately after a strike on the UK mainland by a hostile foreign state.  It will include scenarios in which Britain is hit by conventional missiles, [nuclear warheads](https://www.telegraph.co.uk/world-news/2024/10/29/russia-test-nuclear-missiles-land-sea-air-massive-response/) or cyber operations, which were a limited threat when the last significant update to the plan was made before 2005.  The plan, by the Cabinet Office’s Resilience Directorate, will direct the Prime Minister and Cabinet on how to run a wartime government and when they should seek shelter in the Downing Street bunker or outside London.  The war strategies for the rail and road networks, courts, postal system and phone lines are all expected to be examined. It is unlikely that the document will be released to the public for decades, if at all.  The Cabinet Office has already modelled a scenario in which a hostile state launched missiles and cyber attacks on national infrastructure at the same time.  A risk assessment, published in January, found that a successful attack was “likely to result in civilian fatalities as well as members of the emergency services”, cause serious economic damage and disrupt essential services.  ***Read more:*** [***https://www.telegraph.co.uk/politics/2025/05/05/starmer-prepares-for-attack-by-russia/***](https://www.telegraph.co.uk/politics/2025/05/05/starmer-prepares-for-attack-by-russia/)",1746516425.0,TheTelegraph,worldnews,t3_1kfyljz,t3_1kfyljz,1,/r/worldnews/comments/1kfyljz/starmer_prepares_britain_for_attack_by_russia/mqujffe/
mqukluw,"Putin is winning so much in Ukraine, that he is going to attack Britain. ... yeah, ok , sure.",1746517191.0,KcoolClap,worldnews,t3_1kfyljz,t3_1kfyljz,1,/r/worldnews/comments/1kfyljz/starmer_prepares_britain_for_attack_by_russia/mqukluw/
mquk2ft,Pfft OK.,1746516837.0,The-CunningStunt,worldnews,t3_1kfyljz,t3_1kfyljz,1,/r/worldnews/comments/1kfyljz/starmer_prepares_britain_for_attack_by_russia/mquk2ft/
mqujvp7,"Shit headline as usual.  The plan needs to be updated, f all to do with any pending Russian attack.",1746516717.0,OldLondon,worldnews,t3_1kfyljz,t1_mqujffe,1,/r/worldnews/comments/1kfyljz/starmer_prepares_britain_for_attack_by_russia/mqujvp7/
mqukw8r,I'm surprised they'd openly admit that current defence plans have seen little changes in 20 years,1746517378.0,Jerri_man,worldnews,t3_1kfyljz,t1_mqujffe,1,/r/worldnews/comments/1kfyljz/starmer_prepares_britain_for_attack_by_russia/mqukw8r/
mqulj8c,Glad to know the royal family will have a bunker prepared…,1746517793.0,Monkidispania,worldnews,t3_1kfyljz,t1_mqujffe,1,/r/worldnews/comments/1kfyljz/starmer_prepares_britain_for_attack_by_russia/mqulj8c/
mqullf3,"Elon, Trump, pretty much anyone controlled by Putin seems to be pushing for destabilization of Europe right now, probably because they have much better quality of life and social safety nets",1746517833.0,hibuddha,worldnews,t3_1kfyljz,t1_mqukluw,1,/r/worldnews/comments/1kfyljz/starmer_prepares_britain_for_attack_by_russia/mqullf3/
mqul90t,It is easier to attack unfortified positions. To be fair  sudden attack in Baltic will be successful,1746517608.0,West_Valuable_7146,worldnews,t3_1kfyljz,t1_mqukluw,1,/r/worldnews/comments/1kfyljz/starmer_prepares_britain_for_attack_by_russia/mqul90t/
mquldcl,Lol with what army? Haha Fuck putin.,1746517686.0,ImposterJavaDev,worldnews,t3_1kfyljz,t1_mqul90t,1,/r/worldnews/comments/1kfyljz/starmer_prepares_britain_for_attack_by_russia/mquldcl/
mquhajt,">The percentage of women and children killed in Gaza during the course of Israel’s war against Hamas following the October 7 atrocities is far lower than claimed by the terror group’s media propaganda agency, according to a new study.  Terrorists lie? *shocked pikachu face*",1746515055.0,walrushogmeat,worldnews,t3_1kfxuyw,t3_1kfxuyw,1,/r/worldnews/comments/1kfxuyw/hamas_fatality_figures_for_gaza_war_are_clear/mquhajt/
mquguda,Stone and Rose stated that the higher rate of male child fatalities suggested that a “substantial portion” of boys under the age of 18 were engaged in combat roles during the war.,1746514775.0,jorgoson222,worldnews,t3_1kfxuyw,t3_1kfxuyw,1,/r/worldnews/comments/1kfxuyw/hamas_fatality_figures_for_gaza_war_are_clear/mquguda/
mquegkm,[deleted],1746513323.0,None,worldnews,t3_1kfxuyw,t3_1kfxuyw,1,/r/worldnews/comments/1kfxuyw/hamas_fatality_figures_for_gaza_war_are_clear/mquegkm/
mquku28,Yeah cause I’m gonna listen to a source called times of Israel about this,1746517339.0,Valid-Nite,worldnews,t3_1kfxuyw,t3_1kfxuyw,1,/r/worldnews/comments/1kfxuyw/hamas_fatality_figures_for_gaza_war_are_clear/mquku28/
mqukjeb,"Literally the source is Times of Israel, people, ffs",1746517147.0,YahYahY,worldnews,t3_1kfxuyw,t3_1kfxuyw,1,/r/worldnews/comments/1kfxuyw/hamas_fatality_figures_for_gaza_war_are_clear/mqukjeb/
mqufzfq,"They were talking about 10% in the beginning, if they are admitting 50% now the 70% doesn’t sound too far fetched",1746514251.0,Happy-Watercress3616,worldnews,t3_1kfxuyw,t3_1kfxuyw,1,/r/worldnews/comments/1kfxuyw/hamas_fatality_figures_for_gaza_war_are_clear/mqufzfq/
mquehxn,[removed],1746513347.0,None,worldnews,t3_1kfxuyw,t3_1kfxuyw,1,/r/worldnews/comments/1kfxuyw/hamas_fatality_figures_for_gaza_war_are_clear/mquehxn/
mquep4e,Even 50 percent fatalities of non-combatant deaths is way too high.,1746513469.0,tapdancinghellspawn,worldnews,t3_1kfxuyw,t3_1kfxuyw,1,/r/worldnews/comments/1kfxuyw/hamas_fatality_figures_for_gaza_war_are_clear/mquep4e/
mqukai5,This article does not name the country who did the study.,1746516984.0,AlessandraAthena,worldnews,t3_1kfxuyw,t3_1kfxuyw,1,/r/worldnews/comments/1kfxuyw/hamas_fatality_figures_for_gaza_war_are_clear/mqukai5/
mquka6a,"It's still estimated to be over %50, so still not great.",1746516978.0,SeaBag8211,worldnews,t3_1kfxuyw,t1_mquhajt,1,/r/worldnews/comments/1kfxuyw/hamas_fatality_figures_for_gaza_war_are_clear/mquka6a/
mqukzyy,"Of course they do, but this is also the best figure the public have access to. Israel arent reporting figures and wont allow international journalists in. I wouldnt trust these figures but its all we have to go on really.",1746517446.0,pat_the_tree,worldnews,t3_1kfxuyw,t1_mquhajt,1,/r/worldnews/comments/1kfxuyw/hamas_fatality_figures_for_gaza_war_are_clear/mqukzyy/
mquh0ls,Just because someone is engaged in combat that means you can kill them?!  /s,1746514881.0,BrownEyesGreenHair,worldnews,t3_1kfxuyw,t1_mquguda,1,/r/worldnews/comments/1kfxuyw/hamas_fatality_figures_for_gaza_war_are_clear/mquh0ls/
mquizmh,Or the IDF was targeting male children more than female children.,1746516139.0,SeaBag8211,worldnews,t3_1kfxuyw,t1_mquguda,1,/r/worldnews/comments/1kfxuyw/hamas_fatality_figures_for_gaza_war_are_clear/mquizmh/
mqulhzo,"More concerning is that this particular study was published by the right-wing Henry Jackson Society, which has pushed this same narrative with several other studies in the past.",1746517770.0,gdmaria,worldnews,t3_1kfxuyw,t1_mquku28,1,/r/worldnews/comments/1kfxuyw/hamas_fatality_figures_for_gaza_war_are_clear/mqulhzo/
mqul9p5,"The article is from Times of Israel, the study is not from them. If you're gonna mock internet illiteracy at least do it without being an example of it.   >   Stone is a professor of Mathematical Epidemiology at RMIT University in Melbourne, Australia, while Rose is an honorary professor of law at the University of Wollongong, Australia. Their paper was published by the Henry Jackson Society think tank based in London.",1746517620.0,Kreissv,worldnews,t3_1kfxuyw,t1_mqukjeb,1,/r/worldnews/comments/1kfxuyw/hamas_fatality_figures_for_gaza_war_are_clear/mqul9p5/
mquilah,"No ones admitting 50%, what they're saying is that the data that Hamas has made publicly available via the Gaza health ministry shows that 50% are women and children, in comparison to the 70% claim made by Hamas.  Hamas says 70%, has released data that claims 50%, Israel admits nothing.",1746515881.0,john_andrew_smith101,worldnews,t3_1kfxuyw,t1_mqufzfq,1,/r/worldnews/comments/1kfxuyw/hamas_fatality_figures_for_gaza_war_are_clear/mquilah/
mquhhen,That’s assuming women cannot possibly be combatants.,1746515175.0,waxonwaxoff87,worldnews,t3_1kfxuyw,t1_mquep4e,1,/r/worldnews/comments/1kfxuyw/hamas_fatality_figures_for_gaza_war_are_clear/mquhhen/
mqujeju,"Considering the rate of militant deaths : total deaths is typically 15% in conflicts with populations larger than 750,000 - [https://en.wikipedia.org/wiki/Civilian\_casualty\_ratio#:\~:text=According%20to%20the%20CACE%2C%20in,fatalities%20in%20warfare%20in%20cities](https://en.wikipedia.org/wiki/Civilian_casualty_ratio#:~:text=According%20to%20the%20CACE%2C%20in,fatalities%20in%20warfare%20in%20cities), and Gaza is uniquely dense and has the added bonus of the governing body using their population to shield their militants as well as not doing their duty to protect and move their citizens from the zones of conflict, that would be incorrect.",1746516409.0,TheConsultantIsBack,worldnews,t3_1kfxuyw,t1_mquep4e,1,/r/worldnews/comments/1kfxuyw/hamas_fatality_figures_for_gaza_war_are_clear/mqujeju/
mquj70l,That’s actually way too low. Normally it’s 1:2 - 1:3 and in urban warfare it’s 1:9.,1746516273.0,No_Locksmith_8105,worldnews,t3_1kfxuyw,t1_mquep4e,1,/r/worldnews/comments/1kfxuyw/hamas_fatality_figures_for_gaza_war_are_clear/mquj70l/
mquiar8,Maybe Hamas shouldn’t be conducting military operations whilst hiding behind civilians.,1746515695.0,Dockers4flag2035orB4,worldnews,t3_1kfxuyw,t1_mquep4e,1,/r/worldnews/comments/1kfxuyw/hamas_fatality_figures_for_gaza_war_are_clear/mquiar8/
mqugx0y,"But impossible to avoid in urban warfare, against an enemy that disguises themselves as civilians.",1746514820.0,morriganjane,worldnews,t3_1kfxuyw,t1_mquep4e,1,/r/worldnews/comments/1kfxuyw/hamas_fatality_figures_for_gaza_war_are_clear/mqugx0y/
mquidwz,Not for Hamas. They are figuring out how they can increase it if possible.,1746515750.0,i-like-big-bots,worldnews,t3_1kfxuyw,t1_mquep4e,1,/r/worldnews/comments/1kfxuyw/hamas_fatality_figures_for_gaza_war_are_clear/mquidwz/
mqujqbm,"1 civilian casualty is too high.  Unfortunately, there's never been a large scale urban war in human history that didn't have high civilian casualties. Here's data from the most comparable urban engagements in the 21st century:  - First Battle of Fallujah had a civilian-to-combatant casualty rate of 270%  - Second Battle of Fallujah had a civilian-to-combatant casualty rate of 40-67%  What is the percentage of 'acceptable' civilian casualties in a high-density urban environment?",1746516620.0,Common-Second-1075,worldnews,t3_1kfxuyw,t1_mquep4e,1,/r/worldnews/comments/1kfxuyw/hamas_fatality_figures_for_gaza_war_are_clear/mqujqbm/
mqukx9z,">Stone is a professor of Mathematical Epidemiology at RMIT University in Melbourne, Australia, while Rose is an honorary professor of law at the University of Wollongong, Australia. Their paper was published by the Henry Jackson Society think tank based in London.  from the article",1746517397.0,Ratathosk,worldnews,t3_1kfxuyw,t1_mqukai5,1,/r/worldnews/comments/1kfxuyw/hamas_fatality_figures_for_gaza_war_are_clear/mqukx9z/
mqulutc,No but when one combatant hides with the women and children to use them as human shields then casualties tend to happen.     Some expectations should be that hamas does everything to protect their people instead of using kids bedrooms as RPG launch sites,1746517998.0,JensonInterceptor,worldnews,t3_1kfxuyw,t1_mquka6a,1,/r/worldnews/comments/1kfxuyw/hamas_fatality_figures_for_gaza_war_are_clear/mqulutc/
mquj7eo,"If a 17 year old combatant is firing on them, do you expect the IDF to stop and ask him for ID?",1746516281.0,morriganjane,worldnews,t3_1kfxuyw,t1_mquizmh,1,/r/worldnews/comments/1kfxuyw/hamas_fatality_figures_for_gaza_war_are_clear/mquj7eo/
mqujfla,"So what is it? The IDF is killing indiscriminately or the IDF highly targeted? Hard to keep up with all the gymnastics, I'm not that flexible.",1746516428.0,Common-Second-1075,worldnews,t3_1kfxuyw,t1_mquizmh,1,/r/worldnews/comments/1kfxuyw/hamas_fatality_figures_for_gaza_war_are_clear/mqujfla/
mqulp51,"There was already significant critique on the initial report released by the Henry Jackson Society. Why should we assume this report (I don't know if it is a new report or the same as previously released) is better?   >   Ultimately, while the report underscores the importance of media scrutiny and the verification of war casualty figures, its own selective presentation of evidence undermines its most serious claims. Balanced reporting requires scepticism toward all parties in conflict, and while the media should critically assess MoH data, the same standard should apply to IDF casualty claims.   [https://aoav.org.uk/2024/flawed-critique-how-andrew-foxs-report-for-the-henry-jackson-society-on-gaza-death-toll-lacks-evidence-for-key-claims/](https://aoav.org.uk/2024/flawed-critique-how-andrew-foxs-report-for-the-henry-jackson-society-on-gaza-death-toll-lacks-evidence-for-key-claims/)",1746517899.0,salerg,worldnews,t3_1kfxuyw,t1_mqul9p5,1,/r/worldnews/comments/1kfxuyw/hamas_fatality_figures_for_gaza_war_are_clear/mqulp51/
mqulp8g,So Hamas seems to be lying about 20% while Israel seems to be lying about over twice that amount.,1746517900.0,Sxualhrssmntpanda,worldnews,t3_1kfxuyw,t1_mquilah,1,/r/worldnews/comments/1kfxuyw/hamas_fatality_figures_for_gaza_war_are_clear/mqulp8g/
mqui8tb,"Or ""kids"" under the age of 18: https://x.com/OSINTWarfare/status/1754489519213015063",1746515659.0,barsik_,worldnews,t3_1kfxuyw,t1_mquhhen,1,/r/worldnews/comments/1kfxuyw/hamas_fatality_figures_for_gaza_war_are_clear/mqui8tb/
mqukpaa,"Oh you’re right, then Israel should definitely be bombing civilians then",1746517254.0,YahYahY,worldnews,t3_1kfxuyw,t1_mquiar8,1,/r/worldnews/comments/1kfxuyw/hamas_fatality_figures_for_gaza_war_are_clear/mqukpaa/
mquh44j,"Yeah that's not true, Israel would have to stop their liberal use of explosives though.",1746514943.0,waitaminutewhereiam,worldnews,t3_1kfxuyw,t1_mqugx0y,1,/r/worldnews/comments/1kfxuyw/hamas_fatality_figures_for_gaza_war_are_clear/mquh44j/
mqul0wi,I like how cold you delivered that.,1746517462.0,Kreissv,worldnews,t3_1kfxuyw,t1_mqukx9z,1,/r/worldnews/comments/1kfxuyw/hamas_fatality_figures_for_gaza_war_are_clear/mqul0wi/
mqujog7,"Ur assuming every boy has a gun. Either way, 51% civilian kill rate is a pretty weird flex",1746516586.0,SeaBag8211,worldnews,t3_1kfxuyw,t1_mquj7eo,1,/r/worldnews/comments/1kfxuyw/hamas_fatality_figures_for_gaza_war_are_clear/mqujog7/
mquk519,It's probable many IDF are less discriminating when it come to teenagers. It's not a hard concept to grasp.,1746516883.0,SeaBag8211,worldnews,t3_1kfxuyw,t1_mqujfla,1,/r/worldnews/comments/1kfxuyw/hamas_fatality_figures_for_gaza_war_are_clear/mquk519/
mqui2cd,Well its impossible to avoid unless you want to lose is a better way of putting it.,1746515546.0,OnlyBans1981,worldnews,t3_1kfxuyw,t1_mquh44j,1,/r/worldnews/comments/1kfxuyw/hamas_fatality_figures_for_gaza_war_are_clear/mqui2cd/
mquk5ak,"Unfortunately, there's never been a large scale urban war in human history that didn't have high civilian casualties.   Here's data from the most comparable urban engagements in the 21st century:  - First Battle of Fallujah had a civilian-to-combatant casualty rate of c. 270% - Second Battle of Fallujah had a civilian-to-combatant casualty rate of 40-67%  What is the percentage of 'acceptable' civilian casualties in a high-density urban environment?  Clearly the answer is 0%.  What is the percentage of likely civilian casualties in a high-density urban environment?  It generally starts at around 50% and goes up from there depending on the particulars of the conflict.",1746516888.0,Common-Second-1075,worldnews,t3_1kfxuyw,t1_mquh44j,1,/r/worldnews/comments/1kfxuyw/hamas_fatality_figures_for_gaza_war_are_clear/mquk5ak/
mquhnlh,"Why don’t you share your military insight on how it can be avoided?  Explosives are needed to demolish enemy infrastructure and, in time, the tunnel network underneath.  Hamas is to blame for embedding themselves in “civilian” infrastructure in the first place (a war crime).",1746515284.0,morriganjane,worldnews,t3_1kfxuyw,t1_mquh44j,1,/r/worldnews/comments/1kfxuyw/hamas_fatality_figures_for_gaza_war_are_clear/mquhnlh/
mquks89,"It’s not a flex, it’s the reality of urban guerrilla Warfare.",1746517307.0,morriganjane,worldnews,t3_1kfxuyw,t1_mqujog7,1,/r/worldnews/comments/1kfxuyw/hamas_fatality_figures_for_gaza_war_are_clear/mquks89/
mqukfnr,So you're saying the IDF is very targeted in its operations?,1746517079.0,Common-Second-1075,worldnews,t3_1kfxuyw,t1_mquk519,1,/r/worldnews/comments/1kfxuyw/hamas_fatality_figures_for_gaza_war_are_clear/mqukfnr/
mquicw6,"Nonsense, IDF vastly outnumbers Hamas and it's way better equipped   And about 70 PERCENT OF BUILDINGS IN GAZA ARE EITHER DESTROYED OR DAMAGED    Damage done to Gaza is similiar to damage done to cities subjected to world war two carpet bombing, its a monumental crime against humanity",1746515732.0,waitaminutewhereiam,worldnews,t3_1kfxuyw,t1_mqui2cd,1,/r/worldnews/comments/1kfxuyw/hamas_fatality_figures_for_gaza_war_are_clear/mquicw6/
mqui7iu,"For these people, the mere existence of Israel is an insult and Jews defending themselves is an affront. They will criticize Israel regardless of what happens. That's the issue: it's impossible to argue rationally and in good fate with people who think Israel shouldn't be able to defend itself, or even to exist.",1746515637.0,Same_Performance_595,worldnews,t3_1kfxuyw,t1_mquhnlh,1,/r/worldnews/comments/1kfxuyw/hamas_fatality_figures_for_gaza_war_are_clear/mqui7iu/
mquhqfj,"Ok, here's my military insight: stop bombing shit   Very simple",1746515334.0,waitaminutewhereiam,worldnews,t3_1kfxuyw,t1_mquhnlh,1,/r/worldnews/comments/1kfxuyw/hamas_fatality_figures_for_gaza_war_are_clear/mquhqfj/
mquktrp,"R u trying to doa Mean Girls?, cuz for that to be funny it has to least be at least a bit related to what I just said",1746517334.0,SeaBag8211,worldnews,t3_1kfxuyw,t1_mqukfnr,1,/r/worldnews/comments/1kfxuyw/hamas_fatality_figures_for_gaza_war_are_clear/mquktrp/
mquihuw,Damage done in WW2 but with a tiny fraction of the deaths. Civilians were not warned by their enemies before bombings in WW2.,1746515820.0,Same_Performance_595,worldnews,t3_1kfxuyw,t1_mquicw6,1,/r/worldnews/comments/1kfxuyw/hamas_fatality_figures_for_gaza_war_are_clear/mquihuw/
mquium6,Taking out the enemy’s infrastructure is not a crime against humanity (buildings aren’t human) and is normal in any legal warfare.,1746516050.0,morriganjane,worldnews,t3_1kfxuyw,t1_mquicw6,1,/r/worldnews/comments/1kfxuyw/hamas_fatality_figures_for_gaza_war_are_clear/mquium6/
mquil5u,That’s fine if you’re making a Miss World speech but not if you need to neutralise an enemy drunk on jihad and hell bent on conquering you.,1746515879.0,morriganjane,worldnews,t3_1kfxuyw,t1_mquhqfj,1,/r/worldnews/comments/1kfxuyw/hamas_fatality_figures_for_gaza_war_are_clear/mquil5u/
mquiyy4,God you are so clueless,1746516127.0,lions4life232,worldnews,t3_1kfxuyw,t1_mquhqfj,1,/r/worldnews/comments/1kfxuyw/hamas_fatality_figures_for_gaza_war_are_clear/mquiyy4/
mquijxr,Hamas won't stop bombing shit. Next suggestion.,1746515857.0,Same_Performance_595,worldnews,t3_1kfxuyw,t1_mquhqfj,1,/r/worldnews/comments/1kfxuyw/hamas_fatality_figures_for_gaza_war_are_clear/mquijxr/
mqukylv,Here is a counter offer: Return the hostages and surrender.,1746517421.0,BBorc,worldnews,t3_1kfxuyw,t1_mquhqfj,1,/r/worldnews/comments/1kfxuyw/hamas_fatality_figures_for_gaza_war_are_clear/mqukylv/
mquiq07,"Compare to Gaza, where someone is always conveniently filming the building for a few minutes before it collapses.  They know what’s coming.",1746515967.0,morriganjane,worldnews,t3_1kfxuyw,t1_mquihuw,1,/r/worldnews/comments/1kfxuyw/hamas_fatality_figures_for_gaza_war_are_clear/mquiq07/
mquiq50,"Oh, ok, it's a tiny fraction that makes it ok     Sure Israel is bombing civilian infrastructure but at least they tell the people to fuck off, as if that's easy in a war zone!   How do people see this as acceptable? How would you feel if someone exiled you from your home and bombed it?",1746515969.0,waitaminutewhereiam,worldnews,t3_1kfxuyw,t1_mquihuw,1,/r/worldnews/comments/1kfxuyw/hamas_fatality_figures_for_gaza_war_are_clear/mquiq50/
mquj0pb,[I do love totally legal destruction of enemy infrastructure](https://www.reuters.com/world/un-experts-say-israels-strikes-gaza-amount-collective-punishment-2023-10-12/),1746516159.0,waitaminutewhereiam,worldnews,t3_1kfxuyw,t1_mquium6,1,/r/worldnews/comments/1kfxuyw/hamas_fatality_figures_for_gaza_war_are_clear/mquj0pb/
mquj4n5,Better be clueless than heartless,1746516230.0,waitaminutewhereiam,worldnews,t3_1kfxuyw,t1_mquiyy4,1,/r/worldnews/comments/1kfxuyw/hamas_fatality_figures_for_gaza_war_are_clear/mquj4n5/
mquisma,I do like your insight that Israel uses bombs and missiles the same way Hamas does    Only scale is greater,1746516015.0,waitaminutewhereiam,worldnews,t3_1kfxuyw,t1_mquijxr,1,/r/worldnews/comments/1kfxuyw/hamas_fatality_figures_for_gaza_war_are_clear/mquisma/
mqujcde,Me when I learn war sucks,1746516370.0,No_Locksmith_8105,worldnews,t3_1kfxuyw,t1_mquiq50,1,/r/worldnews/comments/1kfxuyw/hamas_fatality_figures_for_gaza_war_are_clear/mqujcde/
