comment_id,body,created_utc,author,subreddit,link_id,parent_id,score,permalink
mqtxgol,"Central Banker = Socialist! No one can be this stupid, he is playing games.  Carney has worked for the Conservatives in the past as head of the Bank of Canada.   >Prime Minister Stephen Harper today welcomed the appointment of Bank of Canada Governor Mark Carney as Chair of the Financial Stability Board (FSB). The appointment was announced during the G-20 Leaders Summit in Cannes, France.  >“The selection of Mr. Carney as Chair of the Financial Stability Board is testament to his skills and to the strength of Canada’s financial system,” said the Prime Minister. “This is the right appointment at the right time as the world works to strengthen the global financial system and sustain the fragile global economic recovery”.",1746504572.0,Macaw,worldnews,t3_1kfr7ko,t3_1kfr7ko,3,/r/worldnews/comments/1kfr7ko/lutnick_skeptical_of_cutting_a_deal_with_canadas/mqtxgol/
mqtyq8o,Zero qualifications.  In Trumps inner circle because of their shared ‚friend‘ Epstein.  Now destroying your economy for decades to come.  Wow.,1746505149.0,jobager75,worldnews,t3_1kfr7ko,t3_1kfr7ko,3,/r/worldnews/comments/1kfr7ko/lutnick_skeptical_of_cutting_a_deal_with_canadas/mqtyq8o/
mqu02ia,So many assholes in this administration…,1746505730.0,eurotrash1964,worldnews,t3_1kfr7ko,t3_1kfr7ko,3,/r/worldnews/comments/1kfr7ko/lutnick_skeptical_of_cutting_a_deal_with_canadas/mqu02ia/
mqu0ztl,"  # ""You know It wasn't long ago I remember you used to wait in the car, and as far as I'm concerned, YOU SHOULD STILL BE THERE!""",1746506134.0,WhyUReadingThisFool,worldnews,t3_1kfr7ko,t3_1kfr7ko,3,/r/worldnews/comments/1kfr7ko/lutnick_skeptical_of_cutting_a_deal_with_canadas/mqu0ztl/
mqu1ccq,Not a single worthy thing comes out of Howard Buttlick’s mouth.,1746506294.0,Quill-Questions,worldnews,t3_1kfr7ko,t3_1kfr7ko,3,/r/worldnews/comments/1kfr7ko/lutnick_skeptical_of_cutting_a_deal_with_canadas/mqu1ccq/
mqu3443,"Fine don't cut a deal with your LARGEST TRADING PARTNER Canada will survive either way, the USA may not",1746507138.0,JustTheOneGoose22,worldnews,t3_1kfr7ko,t3_1kfr7ko,3,/r/worldnews/comments/1kfr7ko/lutnick_skeptical_of_cutting_a_deal_with_canadas/mqu3443/
mqu3zpp,Lutnick is a squirrel. Complete schmuck.,1746507571.0,General-Ninja9228,worldnews,t3_1kfr7ko,t3_1kfr7ko,3,/r/worldnews/comments/1kfr7ko/lutnick_skeptical_of_cutting_a_deal_with_canadas/mqu3zpp/
mqu4k7f,"Is it a socialist regime that desires affordable medical, dental, pharmaceutical, housing, education, and health care for its taxpaying citizens?    What does it say about a government official who states those goals are not worthy?",1746507856.0,ClubSoda,worldnews,t3_1kfr7ko,t3_1kfr7ko,3,/r/worldnews/comments/1kfr7ko/lutnick_skeptical_of_cutting_a_deal_with_canadas/mqu4k7f/
mqu4ne8,Whereas the entire world is scared to make deals with a facist regime.,1746507903.0,Arlennx,worldnews,t3_1kfr7ko,t3_1kfr7ko,3,/r/worldnews/comments/1kfr7ko/lutnick_skeptical_of_cutting_a_deal_with_canadas/mqu4ne8/
mqu7w10,"lol gonna get tough pussy, you scared yet?",1746509587.0,Unique_Jackfruit_166,worldnews,t3_1kfr7ko,t3_1kfr7ko,3,/r/worldnews/comments/1kfr7ko/lutnick_skeptical_of_cutting_a_deal_with_canadas/mqu7w10/
mqu7ygy,"Translation: ""Who in their right mind would trust our administration?""",1746509623.0,ababalubajones,worldnews,t3_1kfr7ko,t3_1kfr7ko,3,/r/worldnews/comments/1kfr7ko/lutnick_skeptical_of_cutting_a_deal_with_canadas/mqu7ygy/
mqu8wb9,Umm dude Lutnick.  They aren't socialist you fucking hack.   You know this as well.  God I hate the Trump administration.,1746510135.0,Wermys,worldnews,t3_1kfr7ko,t3_1kfr7ko,3,/r/worldnews/comments/1kfr7ko/lutnick_skeptical_of_cutting_a_deal_with_canadas/mqu8wb9/
mqua0fg,Better a socialist nation with morals than a soulless dictatorship with no honour,1746510750.0,Aromatic-Deer3886,worldnews,t3_1kfr7ko,t3_1kfr7ko,3,/r/worldnews/comments/1kfr7ko/lutnick_skeptical_of_cutting_a_deal_with_canadas/mqua0fg/
mque8b0,I keep seeing this as Lunatic,1746513184.0,Spirited-Pin-8450,worldnews,t3_1kfr7ko,t3_1kfr7ko,1,/r/worldnews/comments/1kfr7ko/lutnick_skeptical_of_cutting_a_deal_with_canadas/mque8b0/
mqt1o9i,Better to live in a socialist regime than a moronic one.,1746492646.0,natterca,worldnews,t3_1kfr7ko,t3_1kfr7ko,6,/r/worldnews/comments/1kfr7ko/lutnick_skeptical_of_cutting_a_deal_with_canadas/mqt1o9i/
mqt2k50,Nutlick likes orange balls 🤡,1746492953.0,rajendrarajendra,worldnews,t3_1kfr7ko,t3_1kfr7ko,5,/r/worldnews/comments/1kfr7ko/lutnick_skeptical_of_cutting_a_deal_with_canadas/mqt2k50/
mqt2snu,Canada has a literal left/far left party. They lost a substantial amount of support. Claiming Canada is far left is ludicrous and ignorant at a level of basic facts.,1746493037.0,BIT-NETRaptor,worldnews,t3_1kfr7ko,t3_1kfr7ko,5,/r/worldnews/comments/1kfr7ko/lutnick_skeptical_of_cutting_a_deal_with_canadas/mqt2snu/
mqt3xg8,Im American and even I know that the Liberal party is barely left of centre lmao. What socialist regime?????,1746493431.0,EternalSugar19,worldnews,t3_1kfr7ko,t3_1kfr7ko,4,/r/worldnews/comments/1kfr7ko/lutnick_skeptical_of_cutting_a_deal_with_canadas/mqt3xg8/
mqszqzc,Better than being a fascist regime. At least we don’t deport citizens ,1746491992.0,OddMonkeyManG,worldnews,t3_1kfr7ko,t3_1kfr7ko,4,/r/worldnews/comments/1kfr7ko/lutnick_skeptical_of_cutting_a_deal_with_canadas/mqszqzc/
mqt39z2,Carney is very intelligent man and now he’s going to have to try to speak to Trump at a grade 3 level for him to actually understand anything.,1746493203.0,cherryblaster_90,worldnews,t3_1kfr7ko,t3_1kfr7ko,5,/r/worldnews/comments/1kfr7ko/lutnick_skeptical_of_cutting_a_deal_with_canadas/mqt39z2/
mqtc66o,"""Carney is a dirty socialist!! Anyways, your kids shall only own three toys and you shall only own two pairs of shoes assigned to you by the state"" - Comrade Lutnick",1746496277.0,DZCunuck,worldnews,t3_1kfr7ko,t3_1kfr7ko,4,/r/worldnews/comments/1kfr7ko/lutnick_skeptical_of_cutting_a_deal_with_canadas/mqtc66o/
mqswmpa,It’s impossible to have socialism and communism in Canada. Our laws and constitution are deliberately written to separate powers where needed.,1746490915.0,QuestionMarks4You,worldnews,t3_1kfr7ko,t3_1kfr7ko,6,/r/worldnews/comments/1kfr7ko/lutnick_skeptical_of_cutting_a_deal_with_canadas/mqswmpa/
mqsxm5p,Jfc,1746491258.0,Hoosierauntie,worldnews,t3_1kfr7ko,t3_1kfr7ko,2,/r/worldnews/comments/1kfr7ko/lutnick_skeptical_of_cutting_a_deal_with_canadas/mqsxm5p/
mqsztac,Bold talk coming from a guy literally a letter switch away from being called Nutlick,1746492014.0,grim-old-dog,worldnews,t3_1kfr7ko,t3_1kfr7ko,2,/r/worldnews/comments/1kfr7ko/lutnick_skeptical_of_cutting_a_deal_with_canadas/mqsztac/
mqt01os,Fuck him,1746492094.0,SONOFABIRCH69,worldnews,t3_1kfr7ko,t3_1kfr7ko,2,/r/worldnews/comments/1kfr7ko/lutnick_skeptical_of_cutting_a_deal_with_canadas/mqt01os/
mqt193q,"Skeptical, yea that’s it",1746492502.0,Unkindly_Possession,worldnews,t3_1kfr7ko,t3_1kfr7ko,2,/r/worldnews/comments/1kfr7ko/lutnick_skeptical_of_cutting_a_deal_with_canadas/mqt193q/
mqt1hsc,"Diplomacy is a lost art, under the trump regime.",1746492585.0,NSFW1955,worldnews,t3_1kfr7ko,t3_1kfr7ko,2,/r/worldnews/comments/1kfr7ko/lutnick_skeptical_of_cutting_a_deal_with_canadas/mqt1hsc/
mqt1pmx,How about just cutting a deal with Canada’s government?,1746492660.0,Anteater776,worldnews,t3_1kfr7ko,t3_1kfr7ko,2,/r/worldnews/comments/1kfr7ko/lutnick_skeptical_of_cutting_a_deal_with_canadas/mqt1pmx/
mqt3lku,LOL and Trump praises the ultimate  authoritarian socialist country: North Korea.,1746493315.0,LilLebowskiAchiever,worldnews,t3_1kfr7ko,t3_1kfr7ko,2,/r/worldnews/comments/1kfr7ko/lutnick_skeptical_of_cutting_a_deal_with_canadas/mqt3lku/
mqt3nyj,"Just a note, our right leaning conservatives are more socialist than MAGA fascists. Compared to many countries, Canadian Liberals would be centrist or lightly right of centre. That guy has drank way too much of the Kool Aid. If we’re lucky they’ll get to the Jim Jones Kool-Aid and keep on going.",1746493338.0,ATFGunr,worldnews,t3_1kfr7ko,t3_1kfr7ko,2,/r/worldnews/comments/1kfr7ko/lutnick_skeptical_of_cutting_a_deal_with_canadas/mqt3nyj/
mqt4afs,"""Those socialist Canadians are so unreasonable. They don't want to put tiny screws in IPhones for three generations. Totally unhinged syrup suckers...""",1746493556.0,GStewartcwhite,worldnews,t3_1kfr7ko,t3_1kfr7ko,2,/r/worldnews/comments/1kfr7ko/lutnick_skeptical_of_cutting_a_deal_with_canadas/mqt4afs/
mqt4ls6,"sadly that kind of misconception about socialism is very very common in North America,",1746493665.0,khklee,worldnews,t3_1kfr7ko,t3_1kfr7ko,2,/r/worldnews/comments/1kfr7ko/lutnick_skeptical_of_cutting_a_deal_with_canadas/mqt4ls6/
mqt4o7y,Who gives a fuck about clowns two cents,1746493689.0,ResolutionOwn4933,worldnews,t3_1kfr7ko,t3_1kfr7ko,2,/r/worldnews/comments/1kfr7ko/lutnick_skeptical_of_cutting_a_deal_with_canadas/mqt4o7y/
mqt4zh2,Good. This socialist doesn't want any deals with fascist regimes.,1746493796.0,JPtheGameMaster,worldnews,t3_1kfr7ko,t3_1kfr7ko,2,/r/worldnews/comments/1kfr7ko/lutnick_skeptical_of_cutting_a_deal_with_canadas/mqt4zh2/
mqt6omo,We will have trouble making a deal with fascists and racists,1746494393.0,Acceptable-Baker6334,worldnews,t3_1kfr7ko,t3_1kfr7ko,2,/r/worldnews/comments/1kfr7ko/lutnick_skeptical_of_cutting_a_deal_with_canadas/mqt6omo/
mqt71ch,"Canada sells oil to the US below market price per barrel. These MAGA morons have no idea how much Canada contributes to the US economy. Lumber, Potash, Water. It's no surprise they want to make Canada a state so they can get a better deal.",1746494518.0,PM_Your_Best_Ideas,worldnews,t3_1kfr7ko,t3_1kfr7ko,2,/r/worldnews/comments/1kfr7ko/lutnick_skeptical_of_cutting_a_deal_with_canadas/mqt71ch/
mqt79ob,"Dumbass. The far right always loves to purposely not understand the difference between a social democracy, socialism, Marxism/Leninism/Communism so they can confuse and delude their less intelligent followers.",1746494595.0,CharcoalGreyWolf,worldnews,t3_1kfr7ko,t3_1kfr7ko,2,/r/worldnews/comments/1kfr7ko/lutnick_skeptical_of_cutting_a_deal_with_canadas/mqt79ob/
mqt7aa3,This guys is worse than an ass kisser he is a nut licker,1746494601.0,yopetey,worldnews,t3_1kfr7ko,t3_1kfr7ko,2,/r/worldnews/comments/1kfr7ko/lutnick_skeptical_of_cutting_a_deal_with_canadas/mqt7aa3/
mqt7iik,"Alternative headline- Nutlick has a vastly different opinion someone else has already refuted, backed by science and fact, and he is really mad about it.",1746494680.0,Intelligent_Pack_789,worldnews,t3_1kfr7ko,t3_1kfr7ko,2,/r/worldnews/comments/1kfr7ko/lutnick_skeptical_of_cutting_a_deal_with_canadas/mqt7iik/
mqt7q7f,He is a creeps creep. F. Him.,1746494752.0,Ornery-Ticket834,worldnews,t3_1kfr7ko,t3_1kfr7ko,2,/r/worldnews/comments/1kfr7ko/lutnick_skeptical_of_cutting_a_deal_with_canadas/mqt7q7f/
mqt8m0u,This is the new face of America…. How embarrassing lol,1746495061.0,nelly2929,worldnews,t3_1kfr7ko,t3_1kfr7ko,2,/r/worldnews/comments/1kfr7ko/lutnick_skeptical_of_cutting_a_deal_with_canadas/mqt8m0u/
mqt8s4u,Fuck this is the Movie Canadian Bacon come to life 🤦‍♂️,1746495118.0,chum_slice,worldnews,t3_1kfr7ko,t3_1kfr7ko,2,/r/worldnews/comments/1kfr7ko/lutnick_skeptical_of_cutting_a_deal_with_canadas/mqt8s4u/
mqt9oyh,Bunch of dumbfucks don't even understand what socialism is.,1746495425.0,Talusi,worldnews,t3_1kfr7ko,t3_1kfr7ko,2,/r/worldnews/comments/1kfr7ko/lutnick_skeptical_of_cutting_a_deal_with_canadas/mqt9oyh/
mqt9v9y,We are pretty sceptical of making a deal with a fascist regime.,1746495485.0,CaptianTumbleweed,worldnews,t3_1kfr7ko,t3_1kfr7ko,2,/r/worldnews/comments/1kfr7ko/lutnick_skeptical_of_cutting_a_deal_with_canadas/mqt9v9y/
mqt9z2f,"if Canada was smart, their words should be ""you do like trading stocks, bonds, and commodities on Wall Street right? well, one flip of a switch and we shut down Wall Street and bring all trading to Bay St in Toronto. questions?"" that will shut people like Lutnick up real quick.",1746495521.0,hpbear108,worldnews,t3_1kfr7ko,t3_1kfr7ko,2,/r/worldnews/comments/1kfr7ko/lutnick_skeptical_of_cutting_a_deal_with_canadas/mqt9z2f/
mqtal7d,It must be embarrassing to hear this guy talk. I don't think Howard Limpdick Lunkhead knows what socialism is or anything he says about Canada. Watching him crumble will be so satisfying it will be fattening.,1746495731.0,Felon_musk1939,worldnews,t3_1kfr7ko,t3_1kfr7ko,2,/r/worldnews/comments/1kfr7ko/lutnick_skeptical_of_cutting_a_deal_with_canadas/mqtal7d/
mqtapfd,This guy is so stupid. I accidentally saw a video on Instagram where we was explaining how manufacturing is returning to the USA and I thought that he was just one of the idiot influencer grifters.,1746495773.0,extopico,worldnews,t3_1kfr7ko,t3_1kfr7ko,2,/r/worldnews/comments/1kfr7ko/lutnick_skeptical_of_cutting_a_deal_with_canadas/mqtapfd/
mqtbfki,"I believe that the MAGA/sitting Republicans, the administration and everyone in ICE should be labelled as domestic terrorists by Canada and put on a no fly / stop at the border list.  Let's push Carney to be tough on crime, eh?  They are guilty of kidnapping, assault, human trafficking and in the case of the administration itself, probably initiating an illegal war with fellow NATO nations.  War criminals, terrorists and petty criminals - the lot of them.  Push your MP on it!  Lock them up if they step foot on Canadian territory - then deport them back where they belong, as per the law.",1746496029.0,mr_friend_computer,worldnews,t3_1kfr7ko,t3_1kfr7ko,2,/r/worldnews/comments/1kfr7ko/lutnick_skeptical_of_cutting_a_deal_with_canadas/mqtbfki/
mqtbsu6,The elected “socialist regime”? The one with a banker in charge?,1746496155.0,Lawmonger,worldnews,t3_1kfr7ko,t3_1kfr7ko,2,/r/worldnews/comments/1kfr7ko/lutnick_skeptical_of_cutting_a_deal_with_canadas/mqtbsu6/
mqtc6ec,Definition of “inbred” in Websters.  His inside is as ugly as his outside.,1746496279.0,findingmoore,worldnews,t3_1kfr7ko,t3_1kfr7ko,2,/r/worldnews/comments/1kfr7ko/lutnick_skeptical_of_cutting_a_deal_with_canadas/mqtc6ec/
mqtc9xd,Canada isn't a socialist country. Neither is most of Europe. The ignorance is beyond pathetic for people holding these positions. Just my opinion.,1746496309.0,spydercj,worldnews,t3_1kfr7ko,t3_1kfr7ko,2,/r/worldnews/comments/1kfr7ko/lutnick_skeptical_of_cutting_a_deal_with_canadas/mqtc9xd/
mqtcor7,God I wish it was a socialist regime lol,1746496444.0,OMFGrhombus,worldnews,t3_1kfr7ko,t3_1kfr7ko,2,/r/worldnews/comments/1kfr7ko/lutnick_skeptical_of_cutting_a_deal_with_canadas/mqtcor7/
mqte61h,"I hope carney commits tomorrow to selling all potash and much more steel, oil, not gas and aluminum to no USA countries.  By doing so we will have no more surplus in trade with the USA.  That should address their concerns.",1746496952.0,Winnipeg_Dad,worldnews,t3_1kfr7ko,t3_1kfr7ko,2,/r/worldnews/comments/1kfr7ko/lutnick_skeptical_of_cutting_a_deal_with_canadas/mqte61h/
mqtedes,USA needs to do better.   Be best.,1746497023.0,Superpants999,worldnews,t3_1kfr7ko,t3_1kfr7ko,2,/r/worldnews/comments/1kfr7ko/lutnick_skeptical_of_cutting_a_deal_with_canadas/mqtedes/
mqtef1w,So he’s trying to cover his incompetence with bluster and insults,1746497040.0,edwardothegreatest,worldnews,t3_1kfr7ko,t3_1kfr7ko,2,/r/worldnews/comments/1kfr7ko/lutnick_skeptical_of_cutting_a_deal_with_canadas/mqtef1w/
mqtektj,What a dick head  No class No professionalism No redeeming qualities,1746497095.0,HungryTank2780,worldnews,t3_1kfr7ko,t3_1kfr7ko,2,/r/worldnews/comments/1kfr7ko/lutnick_skeptical_of_cutting_a_deal_with_canadas/mqtektj/
mqtel8x,Democratic Socialism is NOT a bad thing!,1746497099.0,alfienoakes,worldnews,t3_1kfr7ko,t3_1kfr7ko,2,/r/worldnews/comments/1kfr7ko/lutnick_skeptical_of_cutting_a_deal_with_canadas/mqtel8x/
mqtewxa,What an absolute POS,1746497213.0,waldoorfian,worldnews,t3_1kfr7ko,t3_1kfr7ko,2,/r/worldnews/comments/1kfr7ko/lutnick_skeptical_of_cutting_a_deal_with_canadas/mqtewxa/
mqtf063,I hope he doesnt his deals are crap anyways,1746497245.0,Informal_Concern6117,worldnews,t3_1kfr7ko,t3_1kfr7ko,2,/r/worldnews/comments/1kfr7ko/lutnick_skeptical_of_cutting_a_deal_with_canadas/mqtf063/
mqtf4ma,This right here is why Canada needs to tell the current administration to go fuck themselves.  Same as the Chinese are doing.  No respect = no negotiations.,1746497289.0,Both_Sundae2695,worldnews,t3_1kfr7ko,t3_1kfr7ko,2,/r/worldnews/comments/1kfr7ko/lutnick_skeptical_of_cutting_a_deal_with_canadas/mqtf4ma/
mqtf5xd,Their crap is really tiring. I can only repeat what the cult has told me to. Wow.,1746497301.0,CivilWay1444,worldnews,t3_1kfr7ko,t3_1kfr7ko,2,/r/worldnews/comments/1kfr7ko/lutnick_skeptical_of_cutting_a_deal_with_canadas/mqtf5xd/
mqtfdk8,"The more these scumbags open their mouths, the more I want them to experience some true east block treatment.   Might make them miss and appreciate centre-right liberals",1746497378.0,rauho,worldnews,t3_1kfr7ko,t3_1kfr7ko,2,/r/worldnews/comments/1kfr7ko/lutnick_skeptical_of_cutting_a_deal_with_canadas/mqtfdk8/
mqtha23,"Americans really need better education. They continuously get fooled by the whole ""socialist"" rhetoric from Republicans. Every time Republicans don't like something, they just call it ""socialist"" or ""communist"" and people instantly get scared. Doesn't matter if it's actually socialist or not. Ridiculous.",1746498049.0,ClaroStar,worldnews,t3_1kfr7ko,t3_1kfr7ko,2,/r/worldnews/comments/1kfr7ko/lutnick_skeptical_of_cutting_a_deal_with_canadas/mqtha23/
mqti3qg,"""Socialist Regime"" is a fucking oxymoron you moron.",1746498348.0,Cloudhead_Denny,worldnews,t3_1kfr7ko,t3_1kfr7ko,2,/r/worldnews/comments/1kfr7ko/lutnick_skeptical_of_cutting_a_deal_with_canadas/mqti3qg/
mqtkxbk,Lutnick can go fuck a blender.,1746499374.0,rodon25,worldnews,t3_1kfr7ko,t3_1kfr7ko,2,/r/worldnews/comments/1kfr7ko/lutnick_skeptical_of_cutting_a_deal_with_canadas/mqtkxbk/
mqtlawz,Agreed! As Canadian we don’t want any deal with you.,1746499516.0,OkMasterpieceOk,worldnews,t3_1kfr7ko,t3_1kfr7ko,2,/r/worldnews/comments/1kfr7ko/lutnick_skeptical_of_cutting_a_deal_with_canadas/mqtlawz/
mqtlbrv,Wait until he finds out they’ve been doing business with “socialist” Canada for over 150 years!,1746499526.0,theEndIsNigh_2025,worldnews,t3_1kfr7ko,t3_1kfr7ko,2,/r/worldnews/comments/1kfr7ko/lutnick_skeptical_of_cutting_a_deal_with_canadas/mqtlbrv/
mqtmqe8,"If Canada is socialist, I'm Jessica Rabbit.",1746500064.0,WickedShiesty,worldnews,t3_1kfr7ko,t3_1kfr7ko,2,/r/worldnews/comments/1kfr7ko/lutnick_skeptical_of_cutting_a_deal_with_canadas/mqtmqe8/
mqtn6mm,Socialism = anything that doesn’t correspond to trump’s thoughts at a given time,1746500238.0,AdOne5089,worldnews,t3_1kfr7ko,t3_1kfr7ko,2,/r/worldnews/comments/1kfr7ko/lutnick_skeptical_of_cutting_a_deal_with_canadas/mqtn6mm/
mqtnjrq,"Ah, another elected official from the US who spent 8 years in kindergarten eating paste. They seem to be breeding at an alarming rate.",1746500382.0,No-Wonder1139,worldnews,t3_1kfr7ko,t3_1kfr7ko,2,/r/worldnews/comments/1kfr7ko/lutnick_skeptical_of_cutting_a_deal_with_canadas/mqtnjrq/
mqtoam0,Translation: This is harder when you are talking with someone who actually knows what they are doing,1746500676.0,sickofgrouptxt,worldnews,t3_1kfr7ko,t3_1kfr7ko,2,/r/worldnews/comments/1kfr7ko/lutnick_skeptical_of_cutting_a_deal_with_canadas/mqtoam0/
mqtszga,Says the person from the Nazi regime.🤷‍♂️,1746502621.0,Bitch_Posse,worldnews,t3_1kfr7ko,t3_1kfr7ko,2,/r/worldnews/comments/1kfr7ko/lutnick_skeptical_of_cutting_a_deal_with_canadas/mqtszga/
mqtth5t,Is that his real name? Seriously.,1746502830.0,Elbows_Up25,worldnews,t3_1kfr7ko,t3_1kfr7ko,2,/r/worldnews/comments/1kfr7ko/lutnick_skeptical_of_cutting_a_deal_with_canadas/mqtth5t/
mqtuoes,"Whoever made the new free trade agreement between the US, Mexico, and Canada is an idiot.",1746503351.0,reddituseronebillion,worldnews,t3_1kfr7ko,t3_1kfr7ko,2,/r/worldnews/comments/1kfr7ko/lutnick_skeptical_of_cutting_a_deal_with_canadas/mqtuoes/
mqtwnpa,I read lunatic instead lutnick immediately then noticed his face and corrected myself. Same difference. ,1746504212.0,Jly35630,worldnews,t3_1kfr7ko,t3_1kfr7ko,2,/r/worldnews/comments/1kfr7ko/lutnick_skeptical_of_cutting_a_deal_with_canadas/mqtwnpa/
mqtxi7h,We already had a deal twice. What a bunch of fuck sticks.,1746504591.0,jertheman43,worldnews,t3_1kfr7ko,t3_1kfr7ko,2,/r/worldnews/comments/1kfr7ko/lutnick_skeptical_of_cutting_a_deal_with_canadas/mqtxi7h/
mqu002n,Carney is a central banker though lol,1746505703.0,ahmedefwa,worldnews,t3_1kfr7ko,t3_1kfr7ko,2,/r/worldnews/comments/1kfr7ko/lutnick_skeptical_of_cutting_a_deal_with_canadas/mqu002n/
mqu0bvs,This branding is projecting envy.,1746505838.0,cetootski,worldnews,t3_1kfr7ko,t3_1kfr7ko,2,/r/worldnews/comments/1kfr7ko/lutnick_skeptical_of_cutting_a_deal_with_canadas/mqu0bvs/
mqu0pp2,Fucking Nutlick.,1746506005.0,Sad_Inevitable_5841,worldnews,t3_1kfr7ko,t3_1kfr7ko,2,/r/worldnews/comments/1kfr7ko/lutnick_skeptical_of_cutting_a_deal_with_canadas/mqu0pp2/
mqu0weo,[ Removed by Reddit ],1746506090.0,Pen-cap,worldnews,t3_1kfr7ko,t3_1kfr7ko,2,/r/worldnews/comments/1kfr7ko/lutnick_skeptical_of_cutting_a_deal_with_canadas/mqu0weo/
mqude05,"To the extreme right, everyone else is a leftist.",1746512689.0,-Knul-,worldnews,t3_1kfr7ko,t3_1kfr7ko,1,/r/worldnews/comments/1kfr7ko/lutnick_skeptical_of_cutting_a_deal_with_canadas/mqude05/
mquh1ma, Dully elected government means “regime” to American cult followers. Got it.,1746514899.0,TrickBarnacle5578,worldnews,t3_1kfr7ko,t3_1kfr7ko,1,/r/worldnews/comments/1kfr7ko/lutnick_skeptical_of_cutting_a_deal_with_canadas/mquh1ma/
mquham0,"All the time I thought his name was pronounced ""Nutlick"".  Although the way he talks to Trump could be ""Buttlick""  It is so scary that Trump has assembled a team of nutjobs and boot kickers.",1746515056.0,Specific_Success214,worldnews,t3_1kfr7ko,t3_1kfr7ko,1,/r/worldnews/comments/1kfr7ko/lutnick_skeptical_of_cutting_a_deal_with_canadas/mquham0/
mqui7rw,"Good, don’t cut a deal. And make sure you speak in broken, non-sensical sentences like that. We don’t want the Canadians thinking there is even a shred of doubt that they need to cut ties and join arms with the EU and other not-batshit-crazy trading blocs.",1746515642.0,WileyCoyote7,worldnews,t3_1kfr7ko,t3_1kfr7ko,1,/r/worldnews/comments/1kfr7ko/lutnick_skeptical_of_cutting_a_deal_with_canadas/mqui7rw/
mquktkk,"Howard Buttlick is a moron, Mark Carney, socialist?",1746517330.0,Greygor,worldnews,t3_1kfr7ko,t3_1kfr7ko,1,/r/worldnews/comments/1kfr7ko/lutnick_skeptical_of_cutting_a_deal_with_canadas/mquktkk/
mqula6b,Lutnick stupid. Shortened it for them,1746517629.0,Ringohellboy665,worldnews,t3_1kfr7ko,t3_1kfr7ko,1,/r/worldnews/comments/1kfr7ko/lutnick_skeptical_of_cutting_a_deal_with_canadas/mqula6b/
mqt2rsy,I think Carneys objective shouldn't be to try to get a deal because that isn't happening but to use it as an opportunity to voice the opinions of Canadians and make it clear that Canada is moving away from the US.,1746493029.0,Content-Inspector993,worldnews,t3_1kfr7ko,t3_1kfr7ko,4,/r/worldnews/comments/1kfr7ko/lutnick_skeptical_of_cutting_a_deal_with_canadas/mqt2rsy/
mqtlh2i,"Carney is on the Right Wing of a party literally called the Liberals. The new government is centrist at best, and will probably govern like Starmer. He's a conservative wearing red.",1746499581.0,Semper_nemo13,worldnews,t3_1kfr7ko,t3_1kfr7ko,4,/r/worldnews/comments/1kfr7ko/lutnick_skeptical_of_cutting_a_deal_with_canadas/mqtlh2i/
mqsxiy6,"Hey Bub, Canada is a socialist democracy, get your terms straight.  Socialism is the idea of having the state run services like health care.  Oh and you can fuck off with calling yourselves democratic, the US is far down below Canada on the democracy watch ratings of democracies.,",1746491227.0,NFT_fud,worldnews,t3_1kfr7ko,t3_1kfr7ko,8,/r/worldnews/comments/1kfr7ko/lutnick_skeptical_of_cutting_a_deal_with_canadas/mqsxiy6/
mqud976,"Prime Minister Carney, an economist and banker by trade, will make mincemeat out of these dipshit chucklefucks. They know it and they are pissing themselves. He will kill em a dozen times before they hit the ground.",1746512611.0,Odd-Youth-452,worldnews,t3_1kfr7ko,t3_1kfr7ko,2,/r/worldnews/comments/1kfr7ko/lutnick_skeptical_of_cutting_a_deal_with_canadas/mqud976/
mqsznii,I can't believe all the bullshit that comes out of these MAGAt's mouth's! The rest of the world looks on in disbelief that America could be so stupid to vote these clowns in! Disgusting inept Administration 🤢,1746491958.0,Euphoric-Quail662,worldnews,t3_1kfr7ko,t3_1kfr7ko,1,/r/worldnews/comments/1kfr7ko/lutnick_skeptical_of_cutting_a_deal_with_canadas/mqsznii/
mqszusk,Chump,1746492028.0,eiseleyfan,worldnews,t3_1kfr7ko,t3_1kfr7ko,1,/r/worldnews/comments/1kfr7ko/lutnick_skeptical_of_cutting_a_deal_with_canadas/mqszusk/
mqt2epq,And he says that as his administration subsidizes some industry sectors which basically becomes most of their revenue.,1746492900.0,Barb-u,worldnews,t3_1kfr7ko,t3_1kfr7ko,1,/r/worldnews/comments/1kfr7ko/lutnick_skeptical_of_cutting_a_deal_with_canadas/mqt2epq/
mqt3cb1,"Everything in politics  socialism, it just depends on who gets rich and where the money goes.",1746493226.0,SmedlyB,worldnews,t3_1kfr7ko,t3_1kfr7ko,1,/r/worldnews/comments/1kfr7ko/lutnick_skeptical_of_cutting_a_deal_with_canadas/mqt3cb1/
mqt3srj,Lutnick can suck my lutdick!,1746493386.0,Personal_Message_584,worldnews,t3_1kfr7ko,t3_1kfr7ko,1,/r/worldnews/comments/1kfr7ko/lutnick_skeptical_of_cutting_a_deal_with_canadas/mqt3srj/
