comment_id,body,created_utc,author,subreddit,link_id,parent_id,score,permalink
mqudr8z,I think it’s kind of both?,1746512904.0,Omateido,worldnews,t3_1kfwqrh,t1_mqubq5q,1,/r/worldnews/comments/1kfwqrh/many_in_us_and_western_europe_think_third_world/mqudr8z/
mquj44c,"Unfortunately, humanity has an absurd number of nukes.",1746516221.0,bugabooandtwo,worldnews,t3_1kfwqrh,t1_mquf9zn,1,/r/worldnews/comments/1kfwqrh/many_in_us_and_western_europe_think_third_world/mquj44c/
mquh6cg,Hahahaha can't cross the Atlantic? You should go have a look what happened with the sub war games. The US would have enemy subs off the coast before they knew it.,1746514981.0,Known_Limit_6904,worldnews,t3_1kfwqrh,t1_mquf1sp,1,/r/worldnews/comments/1kfwqrh/many_in_us_and_western_europe_think_third_world/mquh6cg/
mquhjnl,"Worth noting the UK only has SLBM, although the range on them is more than sufficient to strike to east-coast targets. The US is also thought to have nearly half as many nukes as we have in total, just stored at their air base in Suffolk (UK). So in the event of anything happening, we would need to somehow ensure that base was taken offline immediately before any F15s or F35s could be scrambled...  I have no doubts we would get absolutely bodied by the US, but the 8 (UK & France) nuclear -armed subs would be a problem the US would have to solve rapidly in the event of a total war.",1746515215.0,xcassets,worldnews,t3_1kfwqrh,t1_mquf1sp,1,/r/worldnews/comments/1kfwqrh/many_in_us_and_western_europe_think_third_world/mquhjnl/
mqujxr2,"What hogwash. You’re talking about accidents and pretending it’s actual national policy decisions. The closest we ever actually got to nuclear annihilation, not one nuke going off by mistake or used in a terror attack, was the Cuban Missile Crisis. And yet, magically, we’re all still here. If you want some links for some helpful reading on 75 years of Cold War nuclear weapon strategy, I’m happy to provide.",1746516753.0,Heffe3737,worldnews,t3_1kfwqrh,t1_mquiz27,1,/r/worldnews/comments/1kfwqrh/many_in_us_and_western_europe_think_third_world/mqujxr2/
mqufjzw,Oh I think that most Russians are well aware of the risks.,1746513990.0,anders_hansson,worldnews,t3_1kfwqrh,t1_mque1jo,1,/r/worldnews/comments/1kfwqrh/many_in_us_and_western_europe_think_third_world/mqufjzw/
mqujkyn,"But you mention those tests were done. But if you read the article or seen the video it shows hundreds of nukes exploding at once. Exploding one or two per few days or so isn't going to cover the continent in smoke. Hundreds all at once and it happening on different locations, could. It's the smoke that's causing the impact on the climate. I could really see this as an issue since it's completely blocking the sun and everything, for days/weeks.  One or two bombs create a big freaking cloud, imagine hundreds of them.",1746516522.0,TheEpiczzz,worldnews,t3_1kfwqrh,t1_mqufbpi,1,/r/worldnews/comments/1kfwqrh/many_in_us_and_western_europe_think_third_world/mqujkyn/
mquguj3,"Those are good points. Do you have another 5 min summary that takes those things i into account?   In the meantime I think that many people just need to realize that a nuclear war is not something that can be won, and that there are fairly well prepared playbooks that dictate certain outcomes (it's not like there will be much debate about which targets to hit etc once the show is on - decisions need to be taken within minutes).",1746514778.0,anders_hansson,worldnews,t3_1kfwqrh,t1_mqufbpi,1,/r/worldnews/comments/1kfwqrh/many_in_us_and_western_europe_think_third_world/mquguj3/
mquijun,Don't forget the emails,1746515856.0,BurningPenguin,worldnews,t3_1kfwqrh,t1_mquceex,1,/r/worldnews/comments/1kfwqrh/many_in_us_and_western_europe_think_third_world/mquijun/
mquexb3,Trump has been very anti nato for the last 10 or so years. He’s already pushing us away from it by starting beef with Canada and Greenland.,1746513607.0,yellowstone727,worldnews,t3_1kfwqrh,t1_mqubm6w,1,/r/worldnews/comments/1kfwqrh/many_in_us_and_western_europe_think_third_world/mquexb3/
mqub954,That's a good pun,1746511447.0,kytheon,worldnews,t3_1kfwqrh,t1_mqu8j0c,3,/r/worldnews/comments/1kfwqrh/many_in_us_and_western_europe_think_third_world/mqub954/
mqu8nat,"They're the countries bordering the major would-be Axis powers, the US, Israel and Russia.",1746509999.0,Violet_Paradox,worldnews,t3_1kfwqrh,t1_mqu805j,-5,/r/worldnews/comments/1kfwqrh/many_in_us_and_western_europe_think_third_world/mqu8nat/
mquat97,Whispers by who? How would a foreign nation take advantage of having the nuclear codes? There isn't some website on the internet where you just input codes and coordinates to start nuking,1746511198.0,Valuable-Explorer-16,worldnews,t3_1kfwqrh,t1_mqu9ohz,2,/r/worldnews/comments/1kfwqrh/many_in_us_and_western_europe_think_third_world/mquat97/
mqugknd,Okay sure sweetie,1746514609.0,hodorhaize,worldnews,t3_1kfwqrh,t1_mqu9ohz,1,/r/worldnews/comments/1kfwqrh/many_in_us_and_western_europe_think_third_world/mqugknd/
mqujo84,We tried appeasement of a murderous dictator once before - we know how it worked out.,1746516582.0,Heffe3737,worldnews,t3_1kfwqrh,t1_mquip1i,1,/r/worldnews/comments/1kfwqrh/many_in_us_and_western_europe_think_third_world/mqujo84/
mqukzf2,"The Ukrainian MOD has 40 Russian aircraft lost or damaged in 2024.   Both of those articles also don’t account for the over 300 Russian planes lost or damaged through the course of the war. Nor do they mention the loss of pilots. Nor do they mention the loss of airframes due to wear and tear. Nor do they mention the loss of high precision weaponry due to attrition. Nor do they mention the loss of experienced air crews.   And I wouldn’t call delivery of 2 new Su-34s in 2025, a 35 year old aircraft, “modernization of the Air Force”.   -372 +24  That math ain’t mathin’ out to “a stronger Russian Air Force” any way you slice it.   It is *laughably* false.",1746517436.0,Heffe3737,worldnews,t3_1kfwqrh,t1_mqujd60,1,/r/worldnews/comments/1kfwqrh/many_in_us_and_western_europe_think_third_world/mqukzf2/
mquk4yc,"And yet largely thanks to US military expenditures, we’ve had 70 of the most peaceful years in human history and society has largely flourished.   The MIC is a problem, no doubt, but to ignore the benefits of US hard power over the past few decades belies a gross misunderstanding of modern geopolitics.",1746516882.0,Heffe3737,worldnews,t3_1kfwqrh,t1_mqujcg4,1,/r/worldnews/comments/1kfwqrh/many_in_us_and_western_europe_think_third_world/mquk4yc/
mqulhlc,The report is incredibly biased and essentially repeats russian threats about “NATO soldiers in Ukraine”. To me there is an underlying ideology there in line with trump’s desire to make strategic rapprochement with Russia.,1746517764.0,Andrew3343,worldnews,t3_1kfwqrh,t1_mqudjun,1,/r/worldnews/comments/1kfwqrh/many_in_us_and_western_europe_think_third_world/mqulhlc/
mquh6yx,Exhausting russia in ukraine buys europe enough time to prepare for complete and total defense to the point where even Putler would not bother attempting to invade,1746514992.0,PrestigePotato,worldnews,t3_1kfwqrh,t1_mquchuh,1,/r/worldnews/comments/1kfwqrh/many_in_us_and_western_europe_think_third_world/mquh6yx/
mqudm4e,"To be fair, we were also told that the sanctions were going to crash their economy. I'm as skeptical of most of the claims economists make as I am of the weather service 2 weeks out.   I'm sure Russia would be fine. Just not thriving, or in a catastrophic scenario if the war stopped tomorrow.",1746512821.0,Melodic-Mirror1973,worldnews,t3_1kfwqrh,t1_mqud4gl,1,/r/worldnews/comments/1kfwqrh/many_in_us_and_western_europe_think_third_world/mqudm4e/
mquhd4s,We didn’t start the fire 🎵🎶🎷,1746515100.0,perec1111,worldnews,t3_1kfwqrh,t1_mqud4gl,1,/r/worldnews/comments/1kfwqrh/many_in_us_and_western_europe_think_third_world/mquhd4s/
mqudva0,"Ive heard this before, but i dont really understand how this would crash their economy?",1746512970.0,yecheesus,worldnews,t3_1kfwqrh,t1_mqud4gl,1,/r/worldnews/comments/1kfwqrh/many_in_us_and_western_europe_think_third_world/mqudva0/
mque27p,"I think you have to be realistic and acknowledge that there are multiple parties in this conflict, and that we certainly enable the war. You can say that it's for the greater good, but the obvious side effect is a heightened risk of WW3.",1746513083.0,anders_hansson,worldnews,t3_1kfwqrh,t1_mqud4gl,1,/r/worldnews/comments/1kfwqrh/many_in_us_and_western_europe_think_third_world/mque27p/
mqufk9k,We tested hundreds of massive nukes over like 3 decades,1746513995.0,WanSum-69,worldnews,t3_1kfwqrh,t1_mque7fb,1,/r/worldnews/comments/1kfwqrh/many_in_us_and_western_europe_think_third_world/mqufk9k/
mqufdnx,"That may be so. Nevertheless I would rather not have it tested, and practically speaking given how many appear to be convinced that we would ""win"" a nuclear war, I'd rather see them believe in a nuclear winter instead.",1746513884.0,anders_hansson,worldnews,t3_1kfwqrh,t1_mque7fb,1,/r/worldnews/comments/1kfwqrh/many_in_us_and_western_europe_think_third_world/mqufdnx/
mquezx1,Do you have a source?,1746513651.0,anders_hansson,worldnews,t3_1kfwqrh,t1_mqudsry,1,/r/worldnews/comments/1kfwqrh/many_in_us_and_western_europe_think_third_world/mquezx1/
mqukabm,"I think you're right. However I think that it's important to understand that most (all?) targets have most likely already been decided in prepared playbooks. Once the shit hits the fan, there is no room for debating targets, as decisions need to be taken withing minutes (basically push the button: yes/no?).",1746516981.0,anders_hansson,worldnews,t3_1kfwqrh,t1_mquic30,1,/r/worldnews/comments/1kfwqrh/many_in_us_and_western_europe_think_third_world/mqukabm/
mquebpc,"Yes, but while the strikes may kill millions, the aftermath may kill billions. [Time - Here’s How Bad a Nuclear War Would Actually Be](https://time.com/6290977/nuclear-war-impact-essay/)",1746513241.0,anders_hansson,worldnews,t3_1kfwqrh,t1_mqudr8z,1,/r/worldnews/comments/1kfwqrh/many_in_us_and_western_europe_think_third_world/mquebpc/
mqui03s,"Look up the number of nuclear submarines with nuclear weapon capabilities per country.  In the vastly unlikely scenario of war between US and UK+FR, Europeans don't stand a ghost of a chance.",1746515506.0,ChaosArcana,worldnews,t3_1kfwqrh,t1_mquh6cg,1,/r/worldnews/comments/1kfwqrh/many_in_us_and_western_europe_think_third_world/mqui03s/
mquea8x,What? Pshhh. Next you'll be telling me those websites that generated Xbox Live Gold codes were fake too.,1746513217.0,Lasagna_Lizard,worldnews,t3_1kfwqrh,t1_mquat97,1,/r/worldnews/comments/1kfwqrh/many_in_us_and_western_europe_think_third_world/mquea8x/
mquhu68,Because having the codes is one big step closer to either using or neutralizing the US nukes.  There's a reason why so many security experts have been screaming about trump for over a decade.,1746515401.0,bugabooandtwo,worldnews,t3_1kfwqrh,t1_mquat97,1,/r/worldnews/comments/1kfwqrh/many_in_us_and_western_europe_think_third_world/mquhu68/
mquk6n8,"Worked out great for everyone involved im sure. You know, conquerors have historically set out to take a piece of land, and when they succeed said ‘this is good, this is enough”.",1746516913.0,ColdButCozy,worldnews,t3_1kfwqrh,t1_mqujo84,1,/r/worldnews/comments/1kfwqrh/many_in_us_and_western_europe_think_third_world/mquk6n8/
mqug0e5,"Read up on wartime economies.   Wars create a massive industry that can artificially prop up an economy for a surprisingly long time. Then the war ends, and the economic crash happens. This is a well established phenomenon.",1746514267.0,Beta_Factor,worldnews,t3_1kfwqrh,t1_mqudm4e,1,/r/worldnews/comments/1kfwqrh/many_in_us_and_western_europe_think_third_world/mqug0e5/
mqufgks,Pretty sure the sanctions did wreck their economy.,1746513932.0,ElonsFetalAlcoholSyn,worldnews,t3_1kfwqrh,t1_mqudm4e,1,/r/worldnews/comments/1kfwqrh/many_in_us_and_western_europe_think_third_world/mqufgks/
mquf5ci,Fine is doing a lot of heavy lifting there.,1746513743.0,Now_Wait-4-Last_Year,worldnews,t3_1kfwqrh,t1_mqudm4e,1,/r/worldnews/comments/1kfwqrh/many_in_us_and_western_europe_think_third_world/mquf5ci/
mquezmd,What economy lol? They have none left. Germany before WW2 was absolutely ruined economically before Hitler turned it into a war economy. Those things don't last and come crashing down eventually. The problem is everyone else has to suffer alongside them,1746513646.0,WanSum-69,worldnews,t3_1kfwqrh,t1_mqudm4e,1,/r/worldnews/comments/1kfwqrh/many_in_us_and_western_europe_think_third_world/mquezmd/
mqufyw1,"Try not to pay too much attention to tabloids, because it's true that they've been saying ""Russian economy to EXPLODE and be SLAMMED and PISS and CUM within two days!"" for about three years now.  The long and short of it is, the Russian economy is balancing on the edge of a cliff right now: important to this, is that they *are* balancing. Behind the scenes, the Russian federal government is doing a lot of work to keep a lot of plates spinning, and so far they've been successful. Sure, quality of life for ordinary Russians has taken a noticeable hit, and military production isn't really keeping up with losses, but Russia really isn't 90's bad right now.  And it's very important to the Russian government that they keep those plates spinning, because if it ever *does* become 90's bad, lots of things suddenly become feasible that aren't really right now.",1746514242.0,Nurhaci1616,worldnews,t3_1kfwqrh,t1_mqudm4e,1,/r/worldnews/comments/1kfwqrh/many_in_us_and_western_europe_think_third_world/mqufyw1/
mqujvzp,"Sanctions work but they are not strict enough to put russian economy down quickly. They definitely have an impact but Biden's administration was too careful to be aggressive. Also, what most westerners keep forgetting is that russians are quite resilient people who can starve but be happy with their 'great motherland' illusion. Most allies think that russians are similar to them but they are very wrong about it.   Their war economy cannot run in the long term and sooner or later sanctions would do their purpose however russians are gambling on western weakness. They are winning an information and propaganda war. They managed to put their people in american administration that managed to shut down all Trump critics in the Republican party. AfD did very well in Germany, Le Penn's buddy is the most popular candidate in the French presidential elections and Reform did win the local elections in UK last week. Not to mention Hungary, Slovakia and seems Romania, countries that not long ago were the victims of russian expansionism. If another conflict breaks out in another middle eastern country or even current indian and pakistani tensions escalates, I'm sure russians will use this in their advance. This will generate huge numbers of refugees and where they all will go? In this case russia would use their agents and useful idiots on both political spectrum to create a huge dissatisfaction in local communities. Leftists will promote letting them in and shout very loudly about their human rights violations in their countries. They would use such words like fascist, white privilege, racists, islamophobes etc in the meantime giving all the cards to populists' hands. And if in 4-5 years from now American leadership will remain in current administration hands while having pro russian people in power at least in 2 of 3 - Britain, France and Germany, who is going to help Ukraine or Baltics? If Ukraine falls and their army is incorporated into russian army, then they could easily conquer much more than they had during cold war.  It's sounds very dark, but looking at current events is that so unachievable?  If the allies really united and did something about Russia, they obviously would win but we are too fragmented and divided and this is what russia wants.",1746516722.0,justsomeone1212,worldnews,t3_1kfwqrh,t1_mqudm4e,1,/r/worldnews/comments/1kfwqrh/many_in_us_and_western_europe_think_third_world/mqujvzp/
mqug1sf,It would have except Germany built an oil pipeline directly to Russia and kept them running.,1746514292.0,runitzerotimes,worldnews,t3_1kfwqrh,t1_mqudm4e,1,/r/worldnews/comments/1kfwqrh/many_in_us_and_western_europe_think_third_world/mqug1sf/
mqug26f,"They had large unemployment, which lowered  significantly as tons of jobs opened up in the military production economy.  The moment the war ends, those jobs are gone and unemployment skyrockets.  The value of Ruble is barely clinging on solely because of government spending towards the war.   It's one big balloon waiting to pop. And a dead economy combined with thousands of jobless traumatised ex-military men is a recipe for revolution.",1746514299.0,mafklap,worldnews,t3_1kfwqrh,t1_mqudva0,1,/r/worldnews/comments/1kfwqrh/many_in_us_and_western_europe_think_third_world/mqug26f/
mqugsdb,"When all of your workers are making guns or lying dead in a field somewhere, who is doing everything else that needs doing?",1746514740.0,Heffe3737,worldnews,t3_1kfwqrh,t1_mqudva0,1,/r/worldnews/comments/1kfwqrh/many_in_us_and_western_europe_think_third_world/mqugsdb/
mqulhwd,"The private sector is basically dead, with the government being the main employer. Except the government is doing that by borrowing from the central bank. Meanwhile inflation is over 50% since the war broke out. They have lost around a million working age men dead or wounded, when they already had a declining population. Not to mention the hundreds if thousands who've fled conscription, mostly from the middle class, who pay the most taxes. Their arms exports not only completely stopped, but they had to ask for some back. But sure, russia's big export was always petrochemicals. Unfortunately for them, oil and has prices have been pretty low recently, and western countries aren't exactly living up to buy from them if other alternatives exist. This resulted in the government having to bail out GAZPROM twice already, which is pretty brutal considering they were russia's main money-maker before the war.",1746517769.0,sakezaf123,worldnews,t3_1kfwqrh,t1_mqudva0,1,/r/worldnews/comments/1kfwqrh/many_in_us_and_western_europe_think_third_world/mqulhwd/
mquga4t,"I think the idea is that their economy is currently rigged for war, and if the war stops it would take some time for Russia to readjust the economy for peace time, and that would most likely mean that the economy would take a hit.   However I don't think that there is much certainty about how bad it would be, it's most likely speculation (e.g. the Russian economy has been much more resilient to western sanctions than most believed).",1746514434.0,anders_hansson,worldnews,t3_1kfwqrh,t1_mqudva0,1,/r/worldnews/comments/1kfwqrh/many_in_us_and_western_europe_think_third_world/mquga4t/
mqug130,"No, the only one at fault is fascist Russia.",1746514280.0,DrDrWest,worldnews,t3_1kfwqrh,t1_mque27p,1,/r/worldnews/comments/1kfwqrh/many_in_us_and_western_europe_think_third_world/mqug130/
mquf58g,"Could you have said that the same in 1939? ""Enabling Czechoslovakia instead of capitulating has as a side effect a heightened risk of ww2""?",1746513741.0,DisillusionedExLib,worldnews,t3_1kfwqrh,t1_mque27p,1,/r/worldnews/comments/1kfwqrh/many_in_us_and_western_europe_think_third_world/mquf58g/
mquinui,"I think the nuclear winter is not caused by the nuclear explosions themselves but rather the firestorms they would unleash if used on targets. Most tests were in desserts, underground or high atmosphere.   Now having hundreds of targets hit and causing the largest firestorms and wildfires ever simultaneously…they might be enough particulate matter to lower the temperature of the earth. Volcanic eruptions are more than capable of doing it - Krakatoa caused temps to fall by about 0.5 degrees and its eruption was equivalent to 200MT of TNT. Our nuclear arsenal can easily dwarf that.",1746515927.0,nevershockasystole,worldnews,t3_1kfwqrh,t1_mqufk9k,1,/r/worldnews/comments/1kfwqrh/many_in_us_and_western_europe_think_third_world/mquinui/
mquiahs,"Ok, it still doesn't change the fact that it's a theory/hypothesis.",1746515691.0,yudo,worldnews,t3_1kfwqrh,t1_mqufk9k,1,/r/worldnews/comments/1kfwqrh/many_in_us_and_western_europe_think_third_world/mquiahs/
mqujg8x,"All in deserts, underground, under sea, in the middle of the ocean and even in the atmosphere but none have wiped out hundreds of cities, which are comprised of, and store massive amounts of ozone depleting chemicals that need no assistance from updrafts to reach that protective layer. Forget nuclear winter. If it happens at that scale, the ozone will be depleted enough to wipe out all plant life on the surface of the planet. No plants means no food, no oxygen, no life.",1746516439.0,monkeywithgun,worldnews,t3_1kfwqrh,t1_mqufk9k,1,/r/worldnews/comments/1kfwqrh/many_in_us_and_western_europe_think_third_world/mqujg8x/
mquilwf,"Honestly, as an overview and quite detailed summary of studies, the Wikipedia article is a typically useful starting point.",1746515892.0,nogeologyhere,worldnews,t3_1kfwqrh,t1_mquezx1,1,/r/worldnews/comments/1kfwqrh/many_in_us_and_western_europe_think_third_world/mquilwf/
mquiv6o,"That's based on one study, which is by no means the only conclusion drawn. There are so many variables that are often over simplified in the more catastrophic modelling of nuclear war, not least the issue of whether soot particulates would actually reach the stratosphere.",1746516060.0,nogeologyhere,worldnews,t3_1kfwqrh,t1_mquebpc,1,/r/worldnews/comments/1kfwqrh/many_in_us_and_western_europe_think_third_world/mquiv6o/
mquiqg2,No maybe not but you can sure as shit guarantee vast swaths of the US will be uninhabited for the next 10k years. Its not a win for anyone 👍,1746515975.0,Known_Limit_6904,worldnews,t3_1kfwqrh,t1_mqui03s,1,/r/worldnews/comments/1kfwqrh/many_in_us_and_western_europe_think_third_world/mquiqg2/
mquia67,Who are the people whispering?,1746515685.0,Valuable-Explorer-16,worldnews,t3_1kfwqrh,t1_mquhu68,1,/r/worldnews/comments/1kfwqrh/many_in_us_and_western_europe_think_third_world/mquia67/
mqul0lg,Precisely.,1746517456.0,Heffe3737,worldnews,t3_1kfwqrh,t1_mquk6n8,1,/r/worldnews/comments/1kfwqrh/many_in_us_and_western_europe_think_third_world/mqul0lg/
mqul0ip,"Thats what the chinese are doing, the russian market is flooded with chinese consumer goods currently.",1746517455.0,MiawHansen,worldnews,t3_1kfwqrh,t1_mqugsdb,1,/r/worldnews/comments/1kfwqrh/many_in_us_and_western_europe_think_third_world/mqul0ip/
mquhaxo,This is not about fault. Those decisions and mistakes were taken years ago and we are now in 2025 and stakes are very different now. Every decision we make carries a risk/benefit analysis. It's also not about appeasement. It's mostly about finding a way that can end the war as favourably as possible for Ukraine.,1746515061.0,anders_hansson,worldnews,t3_1kfwqrh,t1_mqug130,1,/r/worldnews/comments/1kfwqrh/many_in_us_and_western_europe_think_third_world/mquhaxo/
mqukpep,"OTOH these are the kind of uncertainties where everyone is simply better of if we assume the worst case scenario. E.g. if we more accurately could predict that the outcome would not be *that bad*, would the conclusion be that a nuclear war might actually be worth it?",1746517256.0,anders_hansson,worldnews,t3_1kfwqrh,t1_mquiv6o,1,/r/worldnews/comments/1kfwqrh/many_in_us_and_western_europe_think_third_world/mqukpep/
mquhorp,"Okay, putting it like that, I can agree. I thought this was the usual Russian propaganda about NATO.",1746515305.0,DrDrWest,worldnews,t3_1kfwqrh,t1_mquhaxo,1,/r/worldnews/comments/1kfwqrh/many_in_us_and_western_europe_think_third_world/mquhorp/
mqug9lb,"Yup, if you didn't cancel, I am sure Ukraine will send barrage of presents called drones to remind you that you are trespassing on Ukrainian territory you stole.",1746514425.0,macross1984,worldnews,t3_1kfwmjy,t3_1kfwmjy,1,/r/worldnews/comments/1kfwmjy/sevastopol_scraps_victory_day_parade_for_third/mqug9lb/
mqugo7y,A Xenomorph infestation will do that to you.,1746514669.0,Dark_Crowe,worldnews,t3_1kfwmjy,t3_1kfwmjy,1,/r/worldnews/comments/1kfwmjy/sevastopol_scraps_victory_day_parade_for_third/mqugo7y/
mqu3aep,"Users often report submissions from this site for sensationalized articles. Readers have a responsibility to be skeptical, check sources, and comment on any flaws.  You can help improve this thread by linking to media that verifies or questions this article's claims. Your link could help readers better understand this issue.  *I am a bot, and this action was performed automatically. Please [contact the moderators of this subreddit](/message/compose/?to=/r/worldnews) if you have any questions or concerns.*",1746507223.0,AutoModerator,worldnews,t3_1kfwe06,t3_1kfwe06,1,/r/worldnews/comments/1kfwe06/foreign_airlines_avoiding_pakistan_airspace/mqu3aep/
mqu3db1,Another revenue loss for pakistan,1746507263.0,BROWN-MUNDA_,worldnews,t3_1kfwe06,t3_1kfwe06,21,/r/worldnews/comments/1kfwe06/foreign_airlines_avoiding_pakistan_airspace/mqu3db1/
mqu3qmx,seems like Pakistan comes up with a new terrorist attack every few years.,1746507446.0,Morgan_Housel,worldnews,t3_1kfwe06,t3_1kfwe06,15,/r/worldnews/comments/1kfwe06/foreign_airlines_avoiding_pakistan_airspace/mqu3qmx/
mque4bv,Do countries get paid for commercial aviation crossing their airspace? Or is it some sort of ATC fee? How does it work?,1746513118.0,Bruvvimir,worldnews,t3_1kfwe06,t1_mqu3db1,1,/r/worldnews/comments/1kfwe06/foreign_airlines_avoiding_pakistan_airspace/mque4bv/
