comment_id,body,created_utc,author,subreddit,link_id,parent_id,score,permalink
mquf8no,Fun fact: 5 of the 45 US Presidents never won an election. [Scholar survey summaries](https://en.wikipedia.org/wiki/Historical_rankings_of_presidents_of_the_United_States#Scholar_survey_summary) going back to 1948 have never once ranked any of these 5 Presidents in the top half a single time.  A system isn't flawed just because one result was bad. Your definitely underestimating how much uncertainty Sortition would cause every time an election rolls around. Sortition would likely fuel racial tensions as controversial decisions get made by randomly selected groups of citizens that are off by 1% from the racial makeup of America.,1746513799.0,Dauntless_Idiot,worldnews,t3_1kftjkt,t1_mqtsocp,1,/r/worldnews/comments/1kftjkt/ontario_will_suit_up_to_fight_against_possible/mquf8no/
mqtvhaq,"Well, they are proposing charging asylum seekers a $1000 fee.",1746503698.0,wolftron9000,worldnews,t3_1kftjkt,t1_mqtnllj,6,/r/worldnews/comments/1kftjkt/ontario_will_suit_up_to_fight_against_possible/mqtvhaq/
mqty0or,Had to double check what sub I was in,1746504830.0,drama_filled_donut,worldnews,t3_1kftjkt,t1_mqttupr,1,/r/worldnews/comments/1kftjkt/ontario_will_suit_up_to_fight_against_possible/mqty0or/
mquasbd,honey where is my good denim jacket?  https://www.youtube.com/watch?v=x2qRDMHbXaM,1746511183.0,Heavy-Balls,worldnews,t3_1kftjkt,t1_mqtxqmb,1,/r/worldnews/comments/1kftjkt/ontario_will_suit_up_to_fight_against_possible/mquasbd/
mqu1eb4,We're pissed at Trump and the country that voted for him for trying to annex us,1746506320.0,CafeBagels08,worldnews,t3_1kftjkt,t1_mqtzvo5,8,/r/worldnews/comments/1kftjkt/ontario_will_suit_up_to_fight_against_possible/mqu1eb4/
mquih82,A ton of American animated TV shows are also animated here.,1746515808.0,GriffinFlash,worldnews,t3_1kftjkt,t1_mquaqiw,1,/r/worldnews/comments/1kftjkt/ontario_will_suit_up_to_fight_against_possible/mquih82/
mqtn9k6,"How does this create jobs? The entire world will get to enjoy media from other countries for cheaper than us, and that's it?",1746500270.0,Hole_Finder,worldnews,t3_1kftjkt,t1_mqtmaeb,0,/r/worldnews/comments/1kftjkt/ontario_will_suit_up_to_fight_against_possible/mqtn9k6/
mqtl6gm,"Exactly.   And let's not forget that COMPANIES make these choices to offshore or outsource, it's not governments forcing their hands. They are seeking lower prices to maximize profits and they always will.  Speaking of films, I think the US doesn't include entertainment revenue when calculating trade deficits. So all the money brought into the US from abroad for film, music, etc isn't even counted.  Sports as well I believe.",1746499469.0,eightbitfit,worldnews,t3_1kftjkt,t1_mqtjuuz,1,/r/worldnews/comments/1kftjkt/ontario_will_suit_up_to_fight_against_possible/mqtl6gm/
mqufkv6,Like Jury Duty.    Damn... I got summoned to be President for the next quarter.,1746514004.0,drizel,worldnews,t3_1kftjkt,t1_mqtt9ez,1,/r/worldnews/comments/1kftjkt/ontario_will_suit_up_to_fight_against_possible/mqufkv6/
mqui4jq,>5 of the 45 US Presidents never won an election.  What are their names?,1746515585.0,VanceKelley,worldnews,t3_1kftjkt,t1_mquf8no,1,/r/worldnews/comments/1kftjkt/ontario_will_suit_up_to_fight_against_possible/mqui4jq/
mquft9q,"And the ""Golden Visa"" that grants you citizenship for a cool $2 million.",1746514146.0,drizel,worldnews,t3_1kftjkt,t1_mqtvhaq,1,/r/worldnews/comments/1kftjkt/ontario_will_suit_up_to_fight_against_possible/mquft9q/
mqu4a3t,Trying to annex us? If that's the case Carney should probably start taking some proper action right?   The liberals government didn't seem to worried about it when they prorogued parliament and held a leadership race then an election,1746507713.0,picklestheyellowcat,worldnews,t3_1kftjkt,t1_mqu1eb4,-7,/r/worldnews/comments/1kftjkt/ontario_will_suit_up_to_fight_against_possible/mqu4a3t/
mqtns7x,"If we let Trump apply 100% tarrifs on films that are shot in Canada, then studios will stop coming here, and a lot of people will lose their jobs. Same thing goes for VFX industry.",1746500474.0,poudingfinal,worldnews,t3_1kftjkt,t1_mqtn9k6,8,/r/worldnews/comments/1kftjkt/ontario_will_suit_up_to_fight_against_possible/mqtns7x/
mqujyrw,"John Tyler, Millard Fillmore, Andrew Johnson, Chester Arthur and most recently Gerald Ford.  Anything else we can help with?",1746516771.0,indigo-alien,worldnews,t3_1kftjkt,t1_mqui4jq,1,/r/worldnews/comments/1kftjkt/ontario_will_suit_up_to_fight_against_possible/mqujyrw/
mqua6sq,The exact reason we had a snap election was so we could stand up to trumps tyranny with a unified front.,1746510847.0,Lucky-Mia,worldnews,t3_1kftjkt,t1_mqu4a3t,5,/r/worldnews/comments/1kftjkt/ontario_will_suit_up_to_fight_against_possible/mqua6sq/
mqtorrh,"Agreed, apologies. I thought you were advocating for jobs in America, therefore agreeing with the tariff. Yes, the tariffs are unnecessary and are targeted at other countries for no good reason.",1746500868.0,Hole_Finder,worldnews,t3_1kftjkt,t1_mqtns7x,1,/r/worldnews/comments/1kftjkt/ontario_will_suit_up_to_fight_against_possible/mqtorrh/
mqtt2d7,The US is going to get their films have quota limits if they keep this shit up.  It's a huge export for them and I don't think many countries will shed a tear because they only get 6 US blockbusters a year through legal channels.,1746502655.0,lewger,worldnews,t3_1kfteue,t3_1kfteue,8,/r/worldnews/comments/1kfteue/uk_reaffirms_support_for_film_industry_after/mqtt2d7/
mqthqds,Trump supporters who also claim to value “western culture”.  What is he doing to preserve said culture?,1746498216.0,Elegant_Plate6640,worldnews,t3_1kfteue,t3_1kfteue,2,/r/worldnews/comments/1kfteue/uk_reaffirms_support_for_film_industry_after/mqthqds/
mqtghip,"well, another fine measured in minutes of operation... what are ya gonna do, them billionaires are not guilty - it was an Accounting LTD, cant put them LTD's in jail... so a fine it is.🤦‍♂️",1746497767.0,osoBailando,worldnews,t3_1kfteue,t3_1kfteue,1,/r/worldnews/comments/1kfteue/uk_reaffirms_support_for_film_industry_after/mqtghip/
mquljhj,I think they want to isolate the US to feed Trumps verion of reality to Americans  The economic damage Is obvious but they don't care as long as they can shape the mind of the avarage person,1746517798.0,Justwant-toplaycards,worldnews,t3_1kfteue,t1_mqtt2d7,1,/r/worldnews/comments/1kfteue/uk_reaffirms_support_for_film_industry_after/mquljhj/
mqth3zu,Surge in gold prices has obviously attracted gangs.   Now they are willing to kill people for little bit of gold.,1746497989.0,AdSevere1274,worldnews,t3_1kfsswx,t3_1kfsswx,9,/r/worldnews/comments/1kfsswx/peru_suspends_gold_mining_in_north_after_massacre/mqth3zu/
mqtvcov,So nothing new? Cool system…,1746503641.0,Puzzleheaded_Ad2097,worldnews,t3_1kfsswx,t1_mqth3zu,4,/r/worldnews/comments/1kfsswx/peru_suspends_gold_mining_in_north_after_massacre/mqtvcov/
mqt9mcv,More good news for Argentina after finally getting a grip to control rampant hyper inflation.,1746495400.0,macross1984,worldnews,t3_1kfs0ok,t3_1kfs0ok,9,/r/worldnews/comments/1kfs0ok/lundin_mining_reveals_largest_copper_find_in_30/mqt9mcv/
mqtgzhn,Meth heads about to start their migration down to Argentina.,1746497944.0,modernmacgyver,worldnews,t3_1kfs0ok,t3_1kfs0ok,3,/r/worldnews/comments/1kfs0ok/lundin_mining_reveals_largest_copper_find_in_30/mqtgzhn/
mqt2oxh,"From the note:  BHP Group’s joint-venture partner Lundin Mining Corp declared that the companies’ Filo del Sol project in South America to be the largest discovery of copper in three decades, based on new drilling and analysis.  The undeveloped mine contains at least 13 million tons of the metal, as well as significant amounts of gold and silver, Lundin said in a statement on Sunday. Drilling is ongoing, and the deposit’s estimated size is increasing, it said.  Copper mines are getting harder and much more costly to develop, even as global demand for the metal is projected to increase given its role in the energy transition. That outlook has prompted a wave of mergers in the industry, as well as forecasts for persistent deficits — and higher prices — in the future.  The initial so-called mineral resource “has highlighted the potential for one of the highest grade undeveloped open-pit copper projects in the world, and one of the largest gold and silver resources globally,” Chief Executive Officer Jack Lundin said.   BHP acquired Filo Corp in a US$3-billion deal last year, in partnership with Lundin, to gain ownership of two copper projects known as Filo del Sol and Josemaría, which straddle the Argentina-Chile border. The pair will take many years and billions of dollars to develop into new mines.",1746493000.0,ElRama1,worldnews,t3_1kfs0ok,t3_1kfs0ok,8,/r/worldnews/comments/1kfs0ok/lundin_mining_reveals_largest_copper_find_in_30/mqt2oxh/
mqtsvqn,And Argentina will continue to improve under Milei and somehow people will still find a way to try to pretend that he isn’t good for the country,1746502577.0,BelarusianCzar,worldnews,t3_1kfs0ok,t3_1kfs0ok,1,/r/worldnews/comments/1kfs0ok/lundin_mining_reveals_largest_copper_find_in_30/mqtsvqn/
mqtdb2s,"Great, now Trump is going to want Argentina - well once he figures out which continent it is on.",1746496654.0,roscodawg,worldnews,t3_1kfs0ok,t3_1kfs0ok,0,/r/worldnews/comments/1kfs0ok/lundin_mining_reveals_largest_copper_find_in_30/mqtdb2s/
mqtz9vb,"The head of the Lundin family is currently on trial in Sweden for crimes against humanity for their involvement in cleansing populations in oil rich areas in Sudan. [So far, more than 400 threats have been reported by witnesses and six witnesses have been murdered.](https://www.svt.se/nyheter/inrikes/lundin-oil-vittnen-utsatta-for-hot-vald-och-patryckningar)  Of course there is no direct evidence that Lundin is involved in any of these threats or acts of violence.",1746505399.0,LongQualityEquities,worldnews,t3_1kfs0ok,t1_mqt9mcv,7,/r/worldnews/comments/1kfs0ok/lundin_mining_reveals_largest_copper_find_in_30/mqtz9vb/
mqtt0l4,good luck getting through the Argentine bureaucracy and government.,1746502635.0,zahrul3,worldnews,t3_1kfs0ok,t1_mqt2oxh,2,/r/worldnews/comments/1kfs0ok/lundin_mining_reveals_largest_copper_find_in_30/mqtt0l4/
mqtl24y,One of any number of Mexican countries,1746499424.0,Direlion,worldnews,t3_1kfs0ok,t1_mqtdb2s,1,/r/worldnews/comments/1kfs0ok/lundin_mining_reveals_largest_copper_find_in_30/mqtl24y/
mqucgsj,Just a little anarcho-capitalism. Nothing to worry about!,1746512147.0,spaceneenja,worldnews,t3_1kfs0ok,t1_mqtz9vb,2,/r/worldnews/comments/1kfs0ok/lundin_mining_reveals_largest_copper_find_in_30/mqucgsj/
mqu1rqw,You mean the one that has been cut to ribbons by milei?   I think it will be far less difficult to push through then this would have been a few years ago,1746506495.0,Nickpb,worldnews,t3_1kfs0ok,t1_mqtt0l4,3,/r/worldnews/comments/1kfs0ok/lundin_mining_reveals_largest_copper_find_in_30/mqu1rqw/
mqt5vh6,"I can support some kind of action to eliminate all the major cartels, I've long said that if conservatives in the US are really serious about cutting down on illegal immigration, they should be working to help improve conditions in latin american countries, so people don't need to try to come to the US, they can find a decent paying job much closer to home and not have to worry about drug cartels or anything else.  Of course that would presume that US conservatives are actually interested in stopping illegal immigration, not just feeling powerful through acts of intentional cruelty.   What is very clear, however, is that sending troops into another country without invitation is an act of war.",1746494110.0,FreddyForshadowing,worldnews,t3_1kfrw9n,t3_1kfrw9n,295,/r/worldnews/comments/1kfrw9n/mexicos_president_tries_to_defuse_fears_of_us/mqt5vh6/
mqtey8u,"Truth is, we mexicans are not afraid of an one sided armed intervention. We just don't believe what Trump says anymore. If the USA really want to solve the problem, or assist in the solution. stop buying drugs from those guys and stop selling them weapons and ammo.",1746497226.0,Deletereous,worldnews,t3_1kfrw9n,t3_1kfrw9n,72,/r/worldnews/comments/1kfrw9n/mexicos_president_tries_to_defuse_fears_of_us/mqtey8u/
mqua7no,"Speaking of horrible people, trump again threatens a peaceful country with invasion.   Congratulations trump you completed a hat trick threatening 3 peaceful nations with invasion.    Mexico, Canada, and Greenland.",1746510861.0,Glad-Attempt5138,worldnews,t3_1kfrw9n,t3_1kfrw9n,6,/r/worldnews/comments/1kfrw9n/mexicos_president_tries_to_defuse_fears_of_us/mqua7no/
mqtpr6g,"They wanted Donald trump bc he wouldn’t start new wars but within a 100 days or so he has moved tons of military equipment to the middle east incase of war with Iran over the deal he ripped up, threatened to invade Greenland a nato ally, send troops into Mexico illegally, not rule out invading Canada and turning gaza into a resort 💀",1746501272.0,DemonEmperor3,worldnews,t3_1kfrw9n,t3_1kfrw9n,20,/r/worldnews/comments/1kfrw9n/mexicos_president_tries_to_defuse_fears_of_us/mqtpr6g/
mqtb2b0,"USA is making friends everywhere, recently...",1746495896.0,Saorny,worldnews,t3_1kfrw9n,t3_1kfrw9n,9,/r/worldnews/comments/1kfrw9n/mexicos_president_tries_to_defuse_fears_of_us/mqtb2b0/
mqtl04n,"Like a certain other Dictator that cited ""Special Military Operation"" to invade another sovereign nation with military force.",1746499404.0,HimForHer,worldnews,t3_1kfrw9n,t3_1kfrw9n,4,/r/worldnews/comments/1kfrw9n/mexicos_president_tries_to_defuse_fears_of_us/mqtl04n/
mqufzj7,What the fuck has happened to US diplomacy. It feels like the US already finished the game but loaded a previous save and just unleashed godzilla against its allies for the hell of it.,1746514253.0,tingkagol,worldnews,t3_1kfrw9n,t3_1kfrw9n,1,/r/worldnews/comments/1kfrw9n/mexicos_president_tries_to_defuse_fears_of_us/mqufzj7/
mqul6fp,"Leave it to Trump to play the ""weak female"" sex card - when it's he, himself, with obvious mental decline.  Trump's need to LORD is insatiable.",1746517563.0,SciFiCahill,worldnews,t3_1kfrw9n,t3_1kfrw9n,1,/r/worldnews/comments/1kfrw9n/mexicos_president_tries_to_defuse_fears_of_us/mqul6fp/
mqucc5a,"Why doesn't Mexico legalize drugs? Sounds crazy but it would work. Then again, the cartels are actually part of the govt so they would never allow this",1746512071.0,owen__wilsons__nose,worldnews,t3_1kfrw9n,t3_1kfrw9n,1,/r/worldnews/comments/1kfrw9n/mexicos_president_tries_to_defuse_fears_of_us/mqucc5a/
mqt4e83,"Yeah, no.  The Fanta Menace and his horde of howling dipshits is coming.  If Mexico doesn't want to be invaded, their only option is China and ricky tick.",1746493593.0,WinstonFuzzybottom,worldnews,t3_1kfrw9n,t3_1kfrw9n,-15,/r/worldnews/comments/1kfrw9n/mexicos_president_tries_to_defuse_fears_of_us/mqt4e83/
mqtiwpg,"The reality is that Americans don't actually give a fuck about Mexico. Theres a bunch of hilljack high school dropouts that can only afford desert land around the boarder and those worthless fucks are about it but the majority of the US couldnt give two shits. Apologies to Mexico that the scum of our society doesn't have the mental fortitude to be passionate about anything productive. Seriously sorry guys, we left these people behind and now they have voting power and labor jobs that give them a wage which confuses themselves as contributors to society. Like shut up and oil frac you dumb lil oil bitch, we don't pay you to think.",1746498644.0,TeenJesusWasaCunt,worldnews,t3_1kfrw9n,t3_1kfrw9n,-7,/r/worldnews/comments/1kfrw9n/mexicos_president_tries_to_defuse_fears_of_us/mqtiwpg/
mqud6j4,He’s going to do it no matter what. He needs it to invoke the alien enemies act on Mexico deportations.,1746512568.0,theSchmoopy,worldnews,t3_1kfrw9n,t3_1kfrw9n,0,/r/worldnews/comments/1kfrw9n/mexicos_president_tries_to_defuse_fears_of_us/mqud6j4/
mqti3ey,It’s harder than people think. It’s not as simple as giving aid. You’d have to administer the aid and deal the security of that. If you have gang problems they are going to steal the aid before it gets to the people and corrupt officials are going to get the rest.  And unless people have sustainable industries and jobs as soon as the aid is turned off the situation is going to go back to where they were.,1746498345.0,i-can-sleep-for-days,worldnews,t3_1kfrw9n,t1_mqt5vh6,76,/r/worldnews/comments/1kfrw9n/mexicos_president_tries_to_defuse_fears_of_us/mqti3ey/
mqtmb76,Move manufacturing from China to Latin America countries and you’ll see a big change in everything.   Latinos would rather stay home if there are jobs.,1746499899.0,Pegcitymb204,worldnews,t3_1kfrw9n,t1_mqt5vh6,15,/r/worldnews/comments/1kfrw9n/mexicos_president_tries_to_defuse_fears_of_us/mqtmb76/
mqt8hba,"Well you see, if they managed to improve conditions in latin america they would loose half their talking points. Not only ""murica best! look at that other place"" rethoric would take a hit it would also remove one of the main excuses for the exccesive policing in the US.",1746495015.0,kathia154,worldnews,t3_1kfrw9n,t1_mqt5vh6,27,/r/worldnews/comments/1kfrw9n/mexicos_president_tries_to_defuse_fears_of_us/mqt8hba/
mqtc4hk,"It's just a play to have troops permanently in Mexico. Gonna hear a lot of ""We shut down several big Cartels and then more popped up.""",1746496263.0,PlayfulEnergy5953,worldnews,t3_1kfrw9n,t1_mqt5vh6,8,/r/worldnews/comments/1kfrw9n/mexicos_president_tries_to_defuse_fears_of_us/mqtc4hk/
mqtwx8w,"There's no point in taking out the cartels without doing something on the demand side. It's such high risk high reward business that requires zero experience or education that a new cartel will literally form the next day. The war on drugs started in 1971, zero progress in 50 years.",1746504330.0,RN2FL9,worldnews,t3_1kfrw9n,t1_mqt5vh6,9,/r/worldnews/comments/1kfrw9n/mexicos_president_tries_to_defuse_fears_of_us/mqtwx8w/
mqte3tj,"The best way to start going after cartels is full legalization.   That said, we've waited so long that cartels have long since diversified themselves. You'd really need a comprehensive security overhaul in country and a strong public willingness to begin to dismantle them.   And that's where the temptation of pulling an El Salvador begins...",1746496930.0,DustyDeputy,worldnews,t3_1kfrw9n,t1_mqt5vh6,14,/r/worldnews/comments/1kfrw9n/mexicos_president_tries_to_defuse_fears_of_us/mqte3tj/
mqt9s5j,Clear and present danger,1746495456.0,Gloomybyday,worldnews,t3_1kfrw9n,t1_mqt5vh6,2,/r/worldnews/comments/1kfrw9n/mexicos_president_tries_to_defuse_fears_of_us/mqt9s5j/
mqtc4ho,>I can support some kind of action to eliminate all the major cartels  Is it too much to ask to try reducing the demand for drugs in the first place?,1746496263.0,downtofinance,worldnews,t3_1kfrw9n,t1_mqt5vh6,6,/r/worldnews/comments/1kfrw9n/mexicos_president_tries_to_defuse_fears_of_us/mqtc4ho/
mqt9qq2,"> is an act of war  undoubtedly, but it also rarely helps in the field of   > help improve conditions  world police usa and every empire before them have tried it many many times and not once were successful.",1746495443.0,chaseinger,worldnews,t3_1kfrw9n,t1_mqt5vh6,2,/r/worldnews/comments/1kfrw9n/mexicos_president_tries_to_defuse_fears_of_us/mqt9qq2/
mqtadlv,"Legalize everything regulate it. Coca Cola and the Stepan group have imported and proceseed coca leaf here in the US for decades. Fentanyl has over 600+ methods to make it, legalize herion and opiates, fentanyl goes away for the most part. We spend to much effort going the wrong  way looking at these issues.",1746495658.0,Liquor_N_Whorez,worldnews,t3_1kfrw9n,t1_mqt5vh6,4,/r/worldnews/comments/1kfrw9n/mexicos_president_tries_to_defuse_fears_of_us/mqtadlv/
mquim6i,"I do support giving foreign aid when there are disasters and such, but im wary of the US and others being expected to fix all the problems everywhere. Regime change, influence, anti terror operations and so on often do more harm than good. And as we see in many countries, giving alot of aid means propping up corrupt regimes while they let foreign aid keep the people barely afloat so they dont overthrow them (this is not just something i say, but its said by many intelectuals from these countries to. The corrupt regimes need to be allowed to fail. And the way to do this is to not prop them up)  Much like the resource/oil curse many corrupt countries get stuck in foreign aid curse. Reform dont need to happen, we dont need to prepare for hard times because we know the west will bail us out. Therefore we can continue to steal from the people risk free. Its a huge issue and this view is held by many thinkers and ecconemists in developing regions  They will never change on their own, and the people will usually not demand better unless they are angry or desperate.",1746515897.0,Norseviking4,worldnews,t3_1kfrw9n,t1_mqt5vh6,1,/r/worldnews/comments/1kfrw9n/mexicos_president_tries_to_defuse_fears_of_us/mquim6i/
mqtalzy,What about we stop producing and selling so many high-powered guns that end up in these countries for their narco cartels to use?   The idea that one can help create the very conditions that enables the cartels by having a culture that consumes narcotics of all kinds (the cartels exist mainly to supply drugs to the US markets) and then send in the military into an independent country to sort out a problem we create at home is  beyond stupid. The military won't solve the problem anyway...  The first steps should be dealing with the idiotic gun culture enabled at home by misinterpreting the 2A and dealing with illegal drug consumption in America. The answer is not invading some other country. What a stupid country America has become.,1746495739.0,Chocolatoa,worldnews,t3_1kfrw9n,t1_mqt5vh6,-3,/r/worldnews/comments/1kfrw9n/mexicos_president_tries_to_defuse_fears_of_us/mqtalzy/
mqtm1p2,Introspection is required for MAGA why is America the biggest illegal drug market? Drugs can only be made in Mexico?,1746499797.0,Zealot_Alec,worldnews,t3_1kfrw9n,t1_mqt5vh6,0,/r/worldnews/comments/1kfrw9n/mexicos_president_tries_to_defuse_fears_of_us/mqtm1p2/
mqtg44i,The US goverment literally sells them weapons 😆,1746497637.0,Away_Extension_9077,worldnews,t3_1kfrw9n,t1_mqtey8u,27,/r/worldnews/comments/1kfrw9n/mexicos_president_tries_to_defuse_fears_of_us/mqtg44i/
mqtxdbl,">Truth is, we mexicans are not afraid of an one sided armed intervention  Speak for yourself, buddy   >We just don't believe what Trump says anymore   This implies we at some point believed him. We never did.",1746504530.0,MuyalHix,worldnews,t3_1kfrw9n,t1_mqtey8u,13,/r/worldnews/comments/1kfrw9n/mexicos_president_tries_to_defuse_fears_of_us/mqtxdbl/
mqthzb4,It's impossible to get Americans to stop buying drugs.  What is possible is legalizing drugs and taking the monopoly away from cartels.,1746498303.0,The-M0untain,worldnews,t3_1kfrw9n,t1_mqtey8u,13,/r/worldnews/comments/1kfrw9n/mexicos_president_tries_to_defuse_fears_of_us/mqthzb4/
mqu6goa,Yea go tell ghem to stop using drugs. Only the power of love will stop em!!,1746508834.0,XDVI,worldnews,t3_1kfrw9n,t1_mqtey8u,1,/r/worldnews/comments/1kfrw9n/mexicos_president_tries_to_defuse_fears_of_us/mqu6goa/
mqujie9,"To be fair, there is very likelihood of a new conflict involving the US anyway. So the point is moot.",1746516478.0,GreasedUPDoggo,worldnews,t3_1kfrw9n,t1_mqtpr6g,1,/r/worldnews/comments/1kfrw9n/mexicos_president_tries_to_defuse_fears_of_us/mqujie9/
mqudbg7,Mexicans are actually super anti drug. Even stoners are literally looked upon like scum of society. Drug rehab programs literally kidnap people until they get clean,1746512647.0,theSchmoopy,worldnews,t3_1kfrw9n,t1_mqucc5a,4,/r/worldnews/comments/1kfrw9n/mexicos_president_tries_to_defuse_fears_of_us/mqudbg7/
mqt9ca0,"> If Mexico doesn't want to be invaded, their only option is China and ricky tick.  That would be the singular thing that *guarantees* a US invasion of Mexico.",1746495305.0,I_Push_Buttonz,worldnews,t3_1kfrw9n,t1_mqt4e83,7,/r/worldnews/comments/1kfrw9n/mexicos_president_tries_to_defuse_fears_of_us/mqt9ca0/
mqu3evn,"> And unless people have sustainable industries and jobs as soon as the aid is turned off the situation is going to go back to where they were.  Yes but that is built by, say, putting factories in Mexico (a friendly country) instead of China and taking a small cut on the quarterly profit statements.  The reality is Mexico could be helped economically to the point the Cartels (and taking their bribes) are no longer the only game in town anywhere outside of the richest parts of the country. It is just that requires corporations to reduce profits and try to help people which is fundamentally a non-starter even if the US provided security for the factories long enough for such a scheme to function for free.",1746507285.0,WarAmongTheStars,worldnews,t3_1kfrw9n,t1_mqti3ey,14,/r/worldnews/comments/1kfrw9n/mexicos_president_tries_to_defuse_fears_of_us/mqu3evn/
mqtu4jv,"Never claimed it would be easy, just that it would be a better solution than simply deporting people in the most inhumane ways possible as a means to feel good about themselves.",1746503111.0,FreddyForshadowing,worldnews,t3_1kfrw9n,t1_mqti3ey,21,/r/worldnews/comments/1kfrw9n/mexicos_president_tries_to_defuse_fears_of_us/mqtu4jv/
